5622	236712	University of Montreal, Center for Research in Mathematics
5622	A1729	CRAQ, Center for Research in Astrophysics of Quebec
5622	A1746	University of Montreal, Department of Astronomy
	5623	University of Quebec, Canada
5623	14646	University of Quebec, Rimouski
5623	14661	University of Quebec, Chicoutimi
5623	14845	University of Quebec, Montreal
5623	14851	INRS, National Institute for Scientific Research
	5628	Saint Mary's College
	5629	Concordia College
	5630	Morehead State University
	5631	West Virginia University
5635	172302	University of Minnesota, Department of Astronomy
5635	172309	University of Minnesota, Department of Earth Sciences
5635	A1020	University of Minnesota, Department of Physics
5635	A1021	University of Minnesota, Department of Geology and Geophysics
	5640	University of Idaho
	5641	Monterey Bay Aquarium Research Institute
	5649	Central Michigan University
	5651	Cornell College
	5659	Berry College
	5666	Ball State University
	5673	Murdoch University
	5675	Murray State University
	5676	AT&T Bell Laboratories
	5687	Stephen F Austin State University
	5716	Fisk University
	5717	Tennessee State University
	5718	Vanderbilt University
5718	A1017	Vanderbilt University, Department of Physics and Astronomy
5718	A1018	Vanderbilt University, Dyer Observatory
	5723	Griffith University
	5755	Yale University
5755	116473	Yale University, Department of Geology and Geophysics
5755	198903	Yale University, Department of Chemistry
5755	198981	Yale University, Department of Astronomy
5755	198982	Yale University, Department of Geology and Geophysics
5755	198983	Yale University, Department of Physics
5755	A1708	Yale Southern Observatory
	5766	Connecticut College
	5773	University of North Alabama
	5779	Louisiana State University
5779	242454	Louisiana State University, Department of Physics and Astronomy
5779	A1101	Louisiana State University, Department of Geology and Geophysics
	5780	Loyola University New Orleans
	5781	Southern University New Orleans
	5783	Tulane University
	5784	University of New Orleans
	5791	Iona College
	5794	Westminster College
	5798	Columbia University
5798	139207	Columbia University, Department of Physics
5798	155355	Columbia University, Department of Astronomy and Astrophysics
5798	156203	Columbia University, Department of Chemistry
5798	191166	Columbia University, Department of Earth Sciences
5798	57699	Lamont-Doherty Earth Observatory
5798	5919	Barnard College
5798	97058	Goddard Institute for Space Studies
	5844	Marymount Manhattan College
	5845	Niagara University
	5894	New York University
5894	167632	New York University, Abu Dhabi
5894	34242	New York University Polytechnic Institute
5894	A1028	New York University, Department of Physics/CCPP
	5922	Cornell University
5922	12295	Cornell University Medical College
5922	171540	Cornell University, School of Applied Physics
5922	251791	Cornell University, Department of Chemistry
5922	251807	Cornell University, Department of Astronomy/Center for Radiophysics and Space Research
5922	251809	Cornell University, Department of Physics
5922	251813	Cornell University, Department of Computer Science
5922	47790	Cornell University, Department of Earth and Atmospheric Sciences
5922	70235	Cornell University, School of Engineering
5922	A1679	Cornell Sydney University
	5923	Fordham University
	5926	New School University
	5929	Rockefeller University
	5963	American Museum of Natural History
	5965	New Jersey Institute of Technology
5965	A1037	NJIT, Big Bear Solar Observatory
5965	A1038	NJIT, Center for Solar Terrestrial Research
5965	A1039	NJIT, Department of Physics
	5970	Rutgers University
5970	145745	Rutgers University, Department of Earth and Planetary Sciences
5970	172333	Rutgers University, Department of Physics and Astronomy
	5972	University of Delaware
5972	172293	University of Delaware, Bartol Research Institute
	5982	University of Newcastle
5982	234783	University of Newcastle, School of Mathematical and Physical Sciences
	5994	Newcastle University, UK
5994	151502	Newcastle University, Department of Mathematics
5994	A1764	Newcastle University, Department of Physics
	6013	Christopher Newport University
	6025	Bucks County Community College
	6029	Radboud Universiteit Nijmegen
6029	226197	Radboud Universiteit Nijmegen, Department of Astronomy and Physics
	6041	Norfolk State University
	6042	Old Dominion University
	6048	Alabama A&M University
	6049	Illinois State University, Normal
	6087	University of Northampton, UK
	6089	Smith College
6089	A1027	Five College Radio Astronomy Observatory
	6091	Norwich University
	6092	Carleton College
	6093	Saint Olaf College
	6097	Wheaton College, Illinois
	6106	University of East Anglia, UK
	6111	University of Notre Dame
6111	A1092	University of Notre Dame, Department of Physics
6111	A1093	University of Notre Dame, Center for Astrophysics
	6122	Nottingham Trent University, UK
	6123	Nottingham University, UK
6123	309936	Nottingham University, School of Physics and Astronomy
	6146	Oak Ridge National Laboratory
6146	A1053	Oak Ridge National Laboratory, Physics Division
	6167	Oberlin College
	6174	University of Southern Denmark, Odense
	6177	Texas Technological University
	6181	Weber State University
	6186	University of Oklahoma, Oklahoma City
	6187	University of Oklahoma, Norman
6187	A1112	University of Oklahoma, Department of Physics and Astronomy
	6196	New York Institute of Technology
	6216	Creighton University
	6218	Hartwick College
	6221	University of Western Ontario, Canada
6221	A1740	University of Western Ontario, Department of Physics and Astronomy
6221	A1741	University of Western Ontario, Department of Earth Sciences
	6226	Chapman University
	6227	Lamar University
	6230	South Carolina State University
	6233	Orebro University
	6234	Utah Valley University
	6243	University of Central Florida
6243	A1056	University of Central Florida, Department of Physics
6243	A1057	University of Central Florida, College of Optics and Photonics
	6250	University of Maine
6250	115973	University of Maine, Walpole
	6305	University of Oslo
6305	259823	ESST, Society Science and Technology in Europe Program
6305	87350	University of Oslo, Center for Climate and Environmental Research
6305	87361	University of Oslo, Department of Physics
6305	87506	University of Oslo, Department of Geosciences
6305	A1298	University of Oslo, Institute of Theoretical Astrophysics
	6311	Mid Sweden University
	6313	Canada Department of National Defense
6313	60455	Defense Research and Development Canada
6313	85459	Royal Military College of Canada
	6314	Natural Resources Canada
6314	113445	Natural Resources Canada, Department of Earth Sciences
6314	186595	GSCA, Geological Survey of Canada Atlantic
6314	270611	GSCP, Geological Survey of Canada Pacific
	6339	Carleton University, Canada
	6344	Canadian Department of Fisheries and Oceans
	6347	Environment Canada
6347	113197	Meteorological Service of Canada
6347	2085	National Water Research Institute, Canada
	6352	International Development Research Center
6352	108036	International Development Research Center, Senegal 
	6356	National Research Council, Canada
6356	10084	TRIUMF
6356	103199	Herzberg Institute for Astronomy and Astrophysics
6356	124088	DRAO, Dominion Radio Astrophysical Observatory
	6363	University of Ottawa, Canada
6363	151178	University of Ottawa, Department of Earth Sciences
6363	151180	University of Ottawa, Department of Physics
	6370	University of Oulu
6370	A3001	University of Oulu, Department of Physics
6370	A3002	University of Oulu, Division of Astronomy
6370	A3004	Sodankyla Geophysical Observatory
	6395	Oxford Brookes University, UK
	6396	University of Oxford, UK
6396	145276	University of Oxford, Department of Physics
6396	61466	University of Oxford Brasenose College
6396	61481	University of Oxford Magdalen College
6396	61483	University of Oxford Merton College
6396	61493	University of Oxford Saint Catherine's College
6396	61498	University of Oxford Saint John's College
6396	61503	University of Oxford Trinity College
6396	61504	University of Oxford University College Oxford
6396	61505	University of Oxford Wadham College
6396	61506	University of Oxford Wolfson College
6396	66089	University of Oxford, Mathematical Institute
6396	69308	University of Oxford, Department of Earth Sciences
6396	A1759	University of Oxford, Department of Astrophysics
	6413	University of the West of Scotland
	6420	Massey University
	6425	Hewlett Packard Ltd
	6429	Stanford University
6429	164890	Stanford University, School of Earth Sciences
6429	17220	SLAC, Stanford Linear Accelerator Center
6429	198869	Stanford University, Department of Aeronautics and Astronautics
6429	198871	Stanford University, Department of Applied Physics
6429	201958	Stanford University, Department of Electrical Engineering
6429	402869	Stanford University, Department of Geological and Environmental Sciences
6429	A1203	Stanford University, Department of Astronomy
6429	A1204	Stanford University, Department of Physics
6429	A1205	Stanford University, Department of Geophysics
6429	A1417	ICRA, International Center for Relativistic Astrophysics
	6469	California Institute of Technology
6469	224033	California Institute of Technology, Division of Geological and Planetary Sciences
6469	306562	California Institute of Technology, Division of Physics, Mathematics and Astronomy
6469	53411	California Institute of Technology, Jet Propulsion Laboratory
6469	A1037	California Institute of Technology, Big Bear Solar Observatory
6469	A1207	California Institute of Technology, Telescope Science Centers
6469	A1208	California Institute of Technology, Observatories
6469	A1209	California Institute of Technology, Owens Valley Radio Observatory
6469	A1210	California Institute of Technology, LIGO Laboratory
	6489	University of Western Sydney
	6491	University of West Florida
	6496	Bradley University
	6505	Western Australian Museum
	6515	Trent University, Canada
	6527	Drexel University
	6558	Temple University
	6572	University of Pennsylvania
6572	212701	University of Pennsylvania, Department of Chemistry
6572	A1007	University of Pennsylvania, Department of Astronomy
6572	A1008	University of Pennsylvania, Center for Particle Cosmology
6572	A1009	University of Pennsylvania, Department of Physics 
	6594	Pittsburg State University
	6606	La Roche College
	6612	Carnegie Mellon University
6612	92971	Carnegie Mellon University, Qatar
6612	A1088	Carnegie Mellon University, Department of Physics
	6613	Duquesne University
	6614	University of Pittsburgh
6614	142856	University of Pittsburgh, Department of Physics and Astronomy
6614	A1084	University of Pittsburgh, Allegheny Observatory
6614	A1086	University of Pittsburgh, Department of Geology and Planetary Sciences
	6633	University of Plymouth, UK
	6640	Idaho State University
	6654	University of Glamorgan
	6657	Bournemouth University, UK
	6666	Eastern New Mexico University
	6683	Lewis and Clark College
	6686	Reed College
	6689	University of Southern Maine
	6697	University of Portsmouth, UK
6697	416861	University of Portsmouth, Institute of Cosmology and Gravitation
6697	A1768	SEPnet, South-East Physics Network
	6704	Clarkson University
	6711	Vassar College
	6723	University of Central Lancashire, UK
6723	A1758	University of Central Lancashire, Center for Astrophysics
	6727	University of Northern British Columbia, Canada
	6739	Princeton Institute for Advanced Study
	6740	Princeton University
6740	140538	Princeton University, Department of Geosciences
6740	17217	Princeton University, Plasma Physics Laboratory
6740	226624	Princeton University, Department of Astrophysical Sciences
6740	A1023	Princeton University, Department of Physics
	6752	Brown University
6752	158378	Brown University, Department of Geological Sciences
6752	A1016	Brown University, Department of Physics
	6756	Brigham Young University
6756	14678	Brigham Young University, Hawaii
6756	6860	Brigham Young University, Idaho
6756	A1158	Brigham Young University, Department of Physics and Astronomy
	6760	Washington State University
6760	312979	Washington State University, Department of Physics and Astronomy
6760	52670	Washington State University, Tri Cities
6760	A1187	Washington State University, School of Earth and Environmental Sciences
6798	A1040	Triangle Universities Nuclear Laboratory
6798	A1042	North Carolina State University, Department of Physics
	6806	South Dakota School of Mines and Technology
	6814	European Center for Medium Range Weather Forecasts
	6816	University of Reading, UK
6816	150615	University of Reading, School of Mathematical and Physical Sciences
6816	205853	University of Reading, Department of Meteorology
	6822	Albright College
	6832	University of Redlands
	6846	University of Regina, Canada
	6850	University of Nevada System
6850	14722	University of Nevada, Las Vegas
6850	6851	University of Nevada, Reno
6850	A1177	Desert Research Institute
6851	A1175	University of Nevada, Reno, Department of Geological Sciences
	6885	Eastern Kentucky University
	6888	University of Richmond
	6889	Virginia Commonwealth University
	6918	Oakland University
	6925	Rochester Institute of Technology
6925	404578	RIT, School of Physics and Astronomy
	6926	Saint John Fisher College
	6927	University of Rochester
6927	A1026	University of Rochester, Department of Physics and Astronomy
	6971	Rosemont College
	6976	Roskilde University
	7011	Arkansas Technical University
	7017	Mount Allison University, Canada
	7037	Roanoke College
	7046	University of Salford, UK
	7060	University of Utah
7060	402023	University of Utah, Department of Geology and Geophysics
7060	A1157	University of Utah, Department of Physics and Astronomy
	7067	University of Texas System
7067	12329	University of Texas, Arlington
7067	12330	University of Texas, Austin
7067	12331	University of Texas, Brownsville
7067	12335	University of Texas, Dallas
7067	12337	University of Texas, El Paso
7067	12338	University of Texas, Galveston
7067	12346	University of Texas, San Antonio
	7072	Southwest Research Institute
7072	133951	Southwest Research Institute, Boulder
7072	330869	Southwest Research Institute, Department of Space Science
7117	A1198	San Diego State University, Department of Astronomy
	7174	Texas State University San Marcos
	7179	Chevron Oil Co
	7180	UNAM, National Autonomous University of Mexico
7180	111296	UNAM, Institute of Astronomy
7180	124154	UNAM, Institute of Geophysics
7180	173085	UNAM, Center for Geosciences
7180	56075	UNAM, Center for Radioastronomy and Astrophysics
7180	87782	UNAM, Institute of Physical Sciences
7180	87792	UNAM, Institute of Physics
7180	87794	UNAM, Institute of Nuclear Sciences
	7202	National Oceanic and Atmospheric Administration, Washington
7202	114091	NCEI, National Centers for Environmental Information
7202	129423	NOAA Center for Satellite Applications and Research
7202	148449	NOAA National Geodetic Survey
7202	314450	CIRES, Cooperative Institute for Research in Environmental Sciences
7202	53841	NAOO, Great Lakes Environmental Research Laboratory
7202	96721	NAOO, Atlantic Oceanographic and Meteorological Laboratory
7202	A1153	National Oceanic and Atmospheric Administration, Boulder
7202	A1805	NOAA Pacific Marine Environmental Laboratory
7202	A1806	Joint Institute for the Study of the Atmosphere and Ocean
	7203	Santa Fe Institute
	7230	Skidmore College
	7235	University of Saskatchewan, Canada
7235	A1735	University of Saskatchewan, Institute of Space and Atmospheric Studies
7235	A1736	University of Saskatchewan, Department of Physics
	7254	Union College
	7259	University of Scranton
	7284	University of Washington
7284	189579	University of Washington, USGS School of Oceanography
7284	198855	University of Washington, Department of Physics
7284	312706	University of Washington, Department of Astronomy
7284	312733	University of Washington, Department of Earth and Space Sciences
7284	52576	University of Washington, Bothell
7284	A1186	University of Washington, Department of Atmospheric Sciences and Geophysics
7284	A1806	Joint Institute for the Study of the Atmosphere and Ocean
	7296	Susquehanna University
	7302	Texas Lutheran University
	7314	Sheffield Hallam University, UK
	7315	University of Sheffield, UK
7315	152815	University of Sheffield, Department of Physics and Astronomy
	7321	University of Sherbrooke, Canada
	7323	Austin College
	7326	Centenary College
	7334	John Brown University
	7374	New Mexico Institute of Mining and Technology
7374	A1174	New Mexico Institute of Mining and Technology, Department of Physics
	7397	Mount Holyoke College
7397	A1006	Mount Holyoke College, Department of Astronomy
7397	A1027	Five College Radio Astronomy Observatory
	7423	University of Southampton, UK
7423	152284	University of Southampton, School of Ocean and Earth Science
7423	152285	University of Southampton, School of Physics and Astronomy
7423	410476	University of Southampton, Aeronautics and Astronautics
7423	42254	National Oceanography Center, UK
7423	A1768	SEPnet, South-East Physics Network
	7471	Missouri State University
7471	A1103	Missouri State University, Department of Physics and Astronomy
	7473	Western New England University
	7474	Wittenberg University
	7486	Saint Andrews University
7486	150642	Saint Andrews University, School of Mathematics and Statistics
7486	150661	Saint Andrews University, School of Physics and Astronomy
7486	A1755	SUPA, Scottish Universities Physics Alliance
	7497	Brock University, Canada
	7501	Eastern University
	7506	College of Saint Benedict and Saint John's University
	7512	Memorial University of Newfoundland, Canada
7512	A1748	Memorial University of Newfoundland, Department of Earth Sciences
7512	A1749	Memorial University of Newfoundland, Department of Physics
	7547	Saint Louis University
7547	16260	Saint Louis University, Madrid
	7548	Washington University in Saint Louis
7548	366647	Washington University in Saint Louis, Department of Earth and Planetary Science
7548	A1102	Washington University in Saint Louis, Department of Physics
	7549	Webster University
	7569	Macalester College
	7570	University of Saint Thomas
	7573	Gustavus Adolphus College
	7575	Eckerd College
	7581	Stetson University
	7584	University of the Virgin Islands
	7598	Arkansas State University
	7604	Georgia Southern University
	7608	Statoil ASA
	7618	Oklahoma State University
7618	A1120	Oklahoma State University, Department of Physics
	7622	University of Stirling
	7644	Swedish Defence Research Agency
	7654	Royal Swedish Academy of Sciences 
	7655	KTH, Royal Institute of Technology 
7655	11267	AlbaNova University Center
7655	172280	NORDITA, Nordic Institute for Theoretical Physics 
7655	A3014	KTH, Department of Physics 
	7675	Stockholm University 
7675	11267	AlbaNova University Center
7675	132068	Stockholm University, Department of Physics 
7675	172280	NORDITA, Nordic Institute for Theoretical Physics 
7675	243047	Stockholm University, Department of Geological Sciences 
7675	A3010	Stockholm University, Department of Astronomy 
	7699	University of the Pacific
	7703	Staffordshire University, UK
	7709	University of the Highlands and Islands, UK
	7728	Laurentian University, Canada
	7759	University College of Swansea
	7761	Swarthmore College
7761	A1087	Swarthmore College, Department of Physics and Astronomy
	7762	Sweet Briar College
	7767	NERC, National Environment Research Council, UK
7767	1292	Scottish Association for Marine Science
7767	369307	NCAS, National Center for Atmospheric Science
7767	381666	NCEO, National Center for Earth Observation
7767	41819	British Geological Survey
7767	41820	British Antarctic Survey
7767	41865	Center for Ecology and Hydrology
7767	42254	National Oceanography Center, UK
7767	61564	Plymouth Marine Laboratory, UK
	7788	Macquarie University
7788	117653	Macquarie University, Department of Earth and Planetary Sciences
7788	217003	Macquarie University, Department of Physics and Astronomy
7788	A1662	CCFS, Centre of Excellence for Core to Crust Fluid Systems
	7800	University of New South Wales
7800	155101	UNSW@ADFA
7800	194360	University of New South Wales, Institute of Environmental Studies
7800	A1663	University of New South Wales, Centre for Climate Change Research
7800	A1665	University of New South Wales, Department of Astrophysics and Optics
7800	A1667	University of New South Wales, School of Physics
	7812	University of Puget Sound
	7822	Florida A&M University
	7823	Florida State University
7823	A1062	Florida State University, Department of Physics
	7831	University of South Florida
	7832	University of Tampa
	7839	Tampere University of Technology
	7856	Fairleigh Dickinson University
	7864	Arizona State University
7864	200398	Arizona State University, Department of Chemistry and Biochemistry
7864	271919	Arizona State University, Department of Physics and Astronomy
7864	A1163	Arizona State University, School of Earth and Space Exploration
7864	A1164	Arizona State University, Department of Geological Sciences
	7871	Indiana State University
	7890	Lakehead University, Canada
	7911	NEC Corporation
	7923	University of Toledo, Ohio
7923	A1326	University of Toledo, Ohio, Department of Physics and Astronomy
	7932	University of Southern Queensland
	7938	University of Toronto
7938	194389	University of Toronto, Department of Physics
7938	226216	CITA, Canadian Institute for Theoretical Astrophysics
7938	233829	University of Toronto, Department of Astronomy and Astrophysics
7938	33530	University of Toronto, Scarborough
7938	71637	University of Toronto, Mississauga
7938	A1730	Mont Megantic Observatory
	7962	Royal Ontario Museum
	7964	Seneca College, Canada
	7983	Ontario Ministry of Northern Development and Mines
	7991	York University
7991	A1733	York University, Department of Physics and Astronomy
7991	A1734	York University, Center for Research in Space and Terrestrial Science
	8001	James Cook University
	8002	Australian Institute of Marine Sciences
	8016	University of Tromso
8016	A1303	University of Tromso, Auroral Observatory
	8018	University of Trondheim
	8024	Rensselaer Polytechnic Institute
8024	A1030	RPI, Department of Applied Physics and Astronomy
8024	A1031	RPI, Department of Physics, Applied Physics and Astronomy
	8041	University of Arizona
8041	124300	University of Arizona, Department of Planetary Sciences
8041	164485	University of Arizona, Department of Chemistry and Biochemistry
8041	165915	University of Arizona, Department of Hydrology and Water Resources
8041	242727	University of Arizona, Department of Astronomy and Steward Observatory
8041	A1159	University of Arizona, College of Optical Sciences
8041	A1160	University of Arizona, Department of Geosciences
8041	A1417	ICRA, International Center for Relativistic Astrophysics
	8050	University of Tulsa
	8058	University of Turku
8058	226341	Vaisala Institute for Space Physics and Astronomy
8058	226342	Tuorla Observatory
8058	226343	University of Turku, Department of Physics and Astronomy
8058	226344	University of Turku, Space Research Laboratory
	8063	University of Alabama
8063	14843	University of Alabama, Huntsville
8063	9968	University of Alabama, Birmingham
8063	A1098	University of Alabama, Department of Physics and Astronomy
8063	A1099	University of Alabama, Huntsville, Department of Physics
	8075	Umea University 
8075	325191	Umea University, Department of Physics 
8075	A3017	Swedish Institute of Space Physics, Umea 
	8080	Saginaw Valley State University
	8082	Pennsylvania State University
8082	183843	Pennsylvania State University, School of Engineering
8082	250667	Pennsylvania State University, Department of Geosciences
8082	43312	Pennsylvania State University, Erie Behrend College
8082	52463	Pennsylvania State University, Worthington Scranton
8082	52469	Pennsylvania State University, Lehigh Valley
8082	52491	Pennsylvania State University, Wilkes-Barre
8082	52527	Pennsylvania State University, Berks
8082	97485	Pennsylvania State University, Department of Earth Sciences
8082	A1010	Pennsylvania State University, Department of Astronomy
8082	A1011	Pennsylvania State University, Department of Physics
	8083	University of Mississippi
	8087	Montclair State University
	8089	Geological Survey of Sweden 
	8097	Uppsala University 
8097	111166	Uppsala University, Department of Physics and Astronomy 
8097	111167	Uppsala Astronomical Observatory 
8097	325013	Swedish Institute of Space Physics, Uppsala 
8097	A3013	Uppsala University, Department of Earth Sciences 
	8099	Brookhaven National Laboratory
	8101	University of Illinois
8101	14589	University of Illinois, Urbana-Champaign
8101	14681	University of Illinois, Chicago
8101	14682	University of Illinois, Springfield
	8125	Universiteit Utrecht
8125	201225	Universiteit Utrecht, Department of Physics and Astronomy
8125	367844	Universiteit Utrecht, Department of Earth Sciences
8125	84481	Universiteit Utrecht, Faculty of Geosciences
	8142	Valparaiso University
	8166	University of British Columbia, Canada
8166	175064	University of British Columbia, Department of Earth Sciences
8166	233825	University of British Columbia, Department of Physics and Astronomy
8166	97950	University of British Columbia, Okanagan
	8177	Malardalens University
	8191	University of South Dakota
	8205	University of Victoria, Canada
8205	A1742	University of Victoria, Department of Physics and Astronomy
8205	A1743	University of Victoria, School of Earth and Ocean Sciences
	8210	Villanova University
8210	A1019	Villanova University, Department of Astronomy and Astrophysics
	8225	Wageningen Universiteit
	8233	Whitman College
	8243	Bentley University
	8244	Brandeis University
8244	A1015	Brandeis University, Department of Physics
	8264	Smithsonian Institution
8264	53588	National Museum of Natural History
8264	53590	Smithsonian Institution Air and Space Museum
8264	61814	Harvard Smithsonian Center for Astrophysics
8264	A1032	Smithsonian Astrophysical Observatory
8264	A1033	Whipple Observatory, Mt. Hopkins
	8315	University of the District of Columbia
	8358	American Association for the Advancement of Science
	8363	American University
	8365	Catholic University
8365	A1073	Catholic University, Department of Physics
