52949	164052	Bogazici University, Kandilli Observatory
52949	A1421	Feza Gursey Institute of Physics
	52950	Canakkale Onsekiz Mart University
	52954	Cumhuriyet University
	52955	Dogus University
	52956	Dumlupinar University
	52957	Eastern Mediterranean University
	52958	Erciyes University
	52961	Gaziosmanpa University
	52970	Istanbul Culture University
	52971	Istanbul Technical University
52971	315932	Istanbul Technical University, Department of Physics
52971	A1422	Istanbul Technical University, Department of Astronomy and Space Science
	52972	Izmire Institute of Technology
	52976	Karadeniz Technnical University
	52979	Koc University
	52980	Kocaeli University
	52981	Maltepe University
	52982	Marmara University
	52983	Mersin University
	52984	Middle East Technical University
	52985	Mimar Sinan University
	52986	Mugla University
	52989	Nigde University
	52991	Sabanci University
	52992	Sakarya University
	52993	Selcuk University
	52994	Suleyman Demirel University
	52999	Yildiz Technical University
	53000	Yuzuncu Yil University
	53001	Zonguldak Karaelmas University
	53002	Afton Kocatepe University
	53003	Balikesar University
53003	426033	Balikesar University, Department of Physics
	53004	Eskisehir Osmangazi University
	53025	City University of Hong Kong
53031	71121	CAS, Yunnan Observatory
53031	71126	CAS, Purple Mountain Observatory
53031	71139	CAS, Shanghai Observatory
53031	85327	CAS, Xinjiang Observatory
53031	85420	CAS, Changchun Observatory
53041	74612	CAS, Institute of Geodesy and Geophysics
53042	74718	CAS, South China Sea Institute of Oceanology
53043	74709	CAS, Institute of Optics and Electronics
53045	71200	CAS, Institute of Modern Physics, Lanzhou
53045	74779	CAS, Qinghai Institute of Salt Lakes
53045	A1572	CAS, Center of Theoretical Nuclear Physics, China
	53283	INAF, Italian National Institute of Astrophysics
53283	119621	INAF, Astronomical Observatory of Teramo
53283	119634	INAF, Astronomical Observatory of Bologna
53283	119635	INAF, Astronomical Observatory of Cagliari
53283	224983	INAF, Astronomical Observatory of Padua
53283	246694	IAPS, Institute of Astrophysics and Planetary Space Science, Rome
53283	321184	IRA, Institute of Radioastronomy, Bologna
53283	53284	INAF, Astronomical Observatory of Brera, Milan
53283	53285	INAF, Astronomical Observatory of Rome
53283	53286	INAF, Astronomical Observatory of Palermo
53283	53287	INAF, Astronomical Observatory of Trieste
53283	53291	INAF, Astronomical Observatory of Capodimonte
53283	53294	INAF, Astronomical Observatory of Catania
53283	56860	INAF, Astronomical Observatory of Arcetri
53283	56869	INAF, Astronomical Observatory of Torino
	53335	Fukuoka Institute of Technology, Japan
	53347	Japan Society for the Promotion of Science
53411	291561	Jet Propulsion Laboratory, Infrared Processing and Analysis Centre
53411	A1211	Jet Propulsion Laboratory, Space Sciences Division
53411	A1212	Jet Propulsion Laboratory, Earth Sciences and Planetary Division
53468	A1162	National Optical Astronomy Observatory, Chile
53468	A1712	Cerro Tololo Interamerican Observatory
	53572	Ball Aerospace and Technologies Corporation
	53573	Denver Museum of Nature and Science
	53610	Xerox Co
	53616	STMicroelectronics
	53744	Fermi National Accelerator Laboratory
	53777	Aerodyne Research Inc
	53796	Maria Mitchell Observatory
	53824	AIP, American Institute of Physics
	54249	ESO, European Southern Observatory
54249	42681	European Southern Observatory, Chile
54249	A1478	Excellence Cluster Universe
54249	A1480	ESO, Space Telescope European Coordinating Facility
	54344	Karl Schwarzschild Observatory, Tautenburg
54344	A1507	Sonneberg Observatory
54412	A1333	Calar Alto Observatory
54456	120422	CAB, Center for Astrobiology, Madrid
54456	A1324	LAEFF, Laboratory for Space Astrophysics and Theoretical Physics
	54501	Universite de Namur
	54521	Universite de Mons
	54525	Bulgarian Academy of Sciences
54525	277131	Bulgarian Academy of Sciences, Institute for Nuclear Research
54525	A1434	Bulgarian Academy of Sciences, Astronomical Institute
54525	A1435	Bulgarian Academy of Sciences, National Astronomical Observatory
54525	A1438	Bulgarian Academy of Sciences, Institute for Space Research
	54526	New Bulgarian University
	54527	University of Sofia
54527	A1435	University of Sofia, National Astronomical Observatory
54527	A1436	University of Sofia, Department of Astronomy
54527	A1437	University of Sofia, Department of Physics
	54531	CNEN, National Commission for Nuclear Energy
	54545	University Cruzeiro do Sul, Brazil
	54547	University of Botswana
	54548	Belarus National Academy of Sciences
54548	231808	Belarus National Academy of Sciences, Institute of Physics
	54551	National Service of Geology and Mining, Chile
	54557	University of Cyprus
	54561	Tallinn Technical University
	54562	Alexandria University, Egypt
	54570	FORTH, Foundation for Research and Technology
	54571	National Observatory of Athens
54571	130170	IAADET, Institute for Astronomy, Astrophysics, Space Applications and Remote Sensing
	54572	NCSR, National Center for Scientific Research
	54574	National Hellenic Research Foundation
	54583	Rudjer Boskovic Institute, Zagreb
	54589	Hungarian Academy of Sciences
54589	162159	Research Institute for Particle and Nuclear Physics, Budapest
54589	194231	Hungarian Meteorological Service
54589	54595	Konkoly Observatory
54589	61765	Central Research Institute for Physics, Budapest
54589	72857	Geodetic and Geophysical Research Institute, Hungary
54589	A1345	MTA Atomki, Hungary
54589	A1347	Baja Astronomical Observatory, Hungary
54589	A1352	Debrecen Heliophysical Observatory
	54610	University of West Hungary
	54616	Eotvos Lorand University
54616	190216	Eotvos Lorand University, Geophysical Institute
54616	A1348	Eotvos Lorand University, Department of Astronomy
54616	A1349	Eotvos Lorand University, Department of Physics
	54630	Raman Research Institute, Bangalore
	54634	Physical Research Laboratory, India
54634	A1537	Physical Research Laboratory, Astronomy and Astrophysics Division
54634	A1538	Physical Research Laboratory, Space and Atmospheric Sciences Division
54634	A1539	Physical Research Laboratory, Planetary Sciences and Exploration Programme
54634	A1540	Physical Research Laboratory, Udaipur Solar Observatory
	54637	ARIES, Aryabhatta Research Institute of Observational Sciences
	54638	Indian Institute of Geomagnetism
	54649	Agricultural University of Iceland
	54653	National Energy Authority, Iceland
	54658	University of Jordan
	54692	University of Peradeniya, Sri Lanka
	54694	Vilnius University
54694	A1450	Institute for Theoretical Physics and Astronomy
	54712	University Eduardo Mondlane, Mozambique
	54715	Obafemi Awolowo University, Nigeria
	54716	University of Port Harcourt, Nigeria
	54721	University of San Carlos, Philippines
	54724	Ateneo de Manila University, Philippines
	54726	University of the Philippines System
54726	54727	University of the Philippines, Diliman
54726	54729	University of the Philippines, Los Banos
	54736	University of Peshawar
	54739	Romanian Academy
54739	251323	Romanian Academy, Astronomical Institute
54739	A1356	Romanian Academy, Institute of Physics
54739	A1358	Romanian Academy, Institute for Space Sciences
	54741	Babes Bolyai University
	54743	Irkutsk State University
	54744	RAS, Russian Academy of Sciences, Moscow
54744	104659	RAS, Prokhorov Institute for General Physics
54744	104712	RAS, Southern Scientific Center, Rostov
54744	124203	RAS, Lebedev Physics Institute, Moscow
54744	124205	RAS, Space Research Institute, Moscow
54744	124209	RAS, Geophysical Institute, Moscow
54744	133836	RAS, Institute of Dynamics of Geospheres, Moscow
54744	133837	RAS, Institute for Problems in Mechanics, Moscow
54744	133838	RAS, Institute of Astronomy, Moscow
54744	133854	RAS, Pushkov Institute of Terrestrial Magnetism, Ionosphere and Radiowave Propogation, Troitsk
54744	133858	RAS, Institute for Nuclear Research
54744	133861	RAS, Institute for Radioengineering and Electronics
54744	133880	RAS, Institute of Physics of the Earth
54744	133898	RAS, Shirshov Institute of Oceanography
54744	133901	RAS, Pushchino Scientific Center
54744	133919	RAS, Institute of Spectroscopy, Troitsk
54744	133929	RAS, Ussuriisk Astrophysical Observatory
54744	155402	RAS, Institute of Biomedical Problems, Moscow
54744	164234	RAS, Vernadsky Institute of Geochemistry
54744	199813	RAS, Keldysh Institute of Applied Mathematics
54744	220328	RAS, Institute of Physics of the Atmosphere
54744	226301	RAS, Russian Academy of Sciences, Saint Petersburg
54744	228825	RAS, Bach Institute of Biochemistry
54744	231814	RAS, Borok Geophysical Observatory
54744	231858	RAS, Tatarstan
54744	242097	RAS, Russian Academy of Sciences, Tomsk
54744	243805	RAS, Pushchino Radioastronomical Observatory
54744	307730	RAS, Russian Academy of Sciences, Troitsk
54744	307778	RAS, Karelian Institute of Geology
54744	387260	RAS, Institute of Space Physics Research and Radio Wave Propagation
54744	54745	All Russian Research Institute
54744	54749	SAO, Special Astrophysical Observatory
54744	68248	RAS, Landau Institute for Theoretical Physics
54744	68434	RAS, Russian Academy of Sciences, Siberian Branch
54744	68533	RAS, Steklov Mathematical Institute
54744	68564	RAS, Polar Geophysical Institute, Murmansk
54744	68640	RAS, Russian Academy of Sciences, Ural Branch
54744	89107	RAS, Russian Academy of Sciences, Far East
54744	A1463	RAS, Ussuriysk Astrophysical Observatory
54744	A1473	RAS, Astronomical Council
54749	133956	RAS, Central Astronomical Observatory, Pulkovo
	54765	University of Maribor
	54775	Kasetsart University, Thailand
	54782	National Electronics and Computer Technology, Thailand
	54800	Vietnam National University
54800	106160	Ho Chi Minh City University of Science
	54801	University of Belgrade
54801	229718	University of Belgrade, Department of Physics
54801	89101	University of Belgrade, Vinca Institute of Nuclear Sciences
54801	A1342	University of Belgrade, Department of Astronomy
	54908	Thales Alenia Space
54908	207743	Thales Alenia Space, Italia
	55097	BIPM, Bureau International des Poids et Mesures
	55292	CNET, Centre National d'Etudes des Telecommunications
55292	A1261	CETP, Centre d'Etude des Environnements Terrestre et Planetaires, Velizy
	55381	Institut des Hautes Etudes Scientifiques
	55408	CNES, Centre National d'Etudes Spatiales, Paris
55408	214042	CNES, Centre National d'Etudes Spatiales, Toulouse
	55409	Meteo France
55409	84308	SATMOS, Centre de Meteorologie Spatiale
	55439	ONERA, Office National d'Etudes et de Recherche Aerospatiale
55439	52800	ONERA, Toulouse
55439	97067	ONERA, Palaiseau
	55536	Synchrotron SOLEIL
	55553	ESRF, European Synchrotron Radiation Facility
	55925	Pole Universitaire Leonard de Vinci
	55943	NIKHEF, National Institute for Subatomic Physics
55957	A1234	ESTEC, Astrophysics Division
55957	A1235	ESTEC, Space Science Department
55957	A1236	ESTEC, Scientific Support Department
	55958	Royal Dutch Meteor Society
	55960	Dutch National Aerospace Laboratory
	55964	Cape Breton University, Canada
	55983	Dawson College, Canada
	55999	Canadian Space Agency
	56053	Institut Laue-Langevin
	56056	University of Beira Interior
	56057	University of Madeira
	56059	University of Minho
	56062	University of Aveiro
	56066	University of Tras-os-Montes e Alto Douro
	56070	New University of Lisbon
	56081	Chang Gung University, Taiwan
	56082	Ming Chi University of Technology, Taiwan
	56089	Chung Shan Institute of Science and Technology, Taiwan
	56188	Institut de Mathematiques de Marseille
	56351	Geoscience Australia
	56354	Australian Astronomical Observatory
	56390	University of the Western Cape
56390	A1694	University of the Western Cape, Department of Physics and Astronomy
	56391	Durban University of Technology
	56394	University of KwaZulu-Natal, South Africa
56394	A1689	University of KwaZulu-Natal, Astrophysics and Cosmology Research Unit
56394	A1692	University of KwaZulu-Natal, Department of Physics
	56405	North West University
56405	A1693	North West University, Center for Space Research 
	56410	University of Pretoria
	56416	Geological Survey of South Africa
	56417	CSIR, Council for Scientific and Industrial Research
	56499	ENSPM, Ecole National Superieure du Petrole et des Moteurs
	56616	IRF, Swedish Institute of Space Physics, Kiruna 
56616	325013	Swedish Institute of Space Physics, Uppsala 
56616	A3016	Swedish Institute of Space Physics, Lund 
56616	A3017	Swedish Institute of Space Physics, Umea 
	56632	Norwegian Defense Research Establishment
	56667	Hebei University, China
	56708	China Astronaut Research and Training Center
	56711	Southwest Jiaotong University, China
	56714	China West Normal University
	56723	Nelson Mandela Metropolitan University
	56783	Kazimierz Wielki University
	56865	South African Nuclear Energy Corporation
	56866	University of South Africa
	56882	Korea Institute for Advanced Study
	56942	Semnan University, Iran
	56944	Iran University of Science and Technology
	56957	Harish Chandra Research Institute, Allahabad
	57322	Oxford Instruments, PLC
57478	131933	Observatoire de la Cote d'Azur, Artemis Laboratory
57478	131950	Observatoire de la Cote d'Azur, Lagrange Laboratory
57478	131998	Observatoire de la Cote d'Azur, GeoAzur Laboratory
57478	153873	Observatoire de la Cote d'Azur, Calern
57488	117017	IRAM, Institut de RadioAstronomie Millimetrique, Granada
	57507	LGGE, Laboratoire de Glaciologie et Geophysique de l'Environnement
	57577	Southwest University
	57815	NSSRC, National Synchrotron Radiation Research Center
	57870	Oak Ridge Associated Universities
	57904	Daido University, Japan
	57916	Kitami Institute of Technology, Japan
	57921	Kogakuin University, Japan
	57935	Osaka Institute of Technology, Japan
	57945	Tokyo Metropolitan Industrial Technology Research Institute
	58158	Biosphere 2
	58207	Hong Kong University of Science and Technology
	58279	Dalian Institute of Chemical Physics, China
	58286	Huaibei Normal University, China
	58292	Luoyang Normal University, China
	58294	National University of Defense Technology, China
	58588	Makerere University, Uganda
	58802	University of Caxias do Sul, Brazil
	58816	Macau University of Science and Technology, Mongolia
	58818	University of Colombo, Sri Lanka
	58835	University of Ghana
	58953	Agency for Defense Development, Korea
	58987	University of Ibadan, Nigeria
	58989	Ahmadu Bello University, Nigeria
	59100	Rhodes University
	59105	University of Sharjah, UAE
	59121	University of Bahrain
	59166	Gadjah Mada University, Indonesia
	59176	Al-Hussein Bin Talal University, Jordan
	59178	Mutah University, Jordan
	59179	Yarmouk University, Jordan
	59192	Macau University of Science and Technology
	59198	Covenant University, Nigeria
	59212	Naresuan University, Thailand
	59215	National United, Taiwan
	59503	Al-Balqa Applied University, Jordan
	60451	Camosun College, Canada
	60499	Oslo College of Engineering
	60738	CECS, Center for Scientific Studies, Chile
	60994	Philips Research Laboratory
	61147	Al Quds University, Jerusalem
	61244	Geological Survey of Israel
	61375	Heidelberg Academy of Sciences
	61758	University of Sciences and Technology Houari Boumediene, Algeria
	61767	Al al-Bayt University, Jordan
	61768	Lithuanian Academy of Sciences
61768	A1450	Institute for Theoretical Physics and Astronomy
	61769	University of Latvia
61769	A1448	University of Latvia, Astronomical Observatory
	61770	University of Benghazi, Libya
	61771	University of Mauritius
	61774	International Islamic University of Malaysia
	61775	University Kebangsaan, Malaysia
	61778	Pakistan Atomic Energy Commission
	61779	PINSTECH, Pakistan Institute of Nuclear Science and Technology
	61780	Qatar University
	61783	University of Bucharest
61783	A1355	University of Bucharest, Institute of Physics
	61791	Technical University of Bratislava
	61794	King Mongkut's Institute of Technology, Ladkrabang
	61796	University of Carthage, Tunisia
	61797	Vietnam Academy of Science and Technology
	61798	University of Zululand
	61799	University of Johannesburg
	61801	NRF, National Research Foundation, South Africa
61801	274458	South African Environmental Observation Network
61801	61800	South African National Space Agency
61801	61802	Hartebeesthoek Radio Astronomy Observatory
61801	61803	SAAO, South African Astronomical Observatory
	61807	National University of Lesotho
	61810	Budapest University of Technology and Economics
61814	A1231	Harvard Smithsonian Center for Astrophysics, Submillimeter Array
	61832	General Atomics
	61864	Draper Laboratory, Inc.
	61963	Texas Instruments, Inc.
	62384	Baku State University
	62386	Indian Institute of Astrophysics, Bangalore
	62389	Solid State Physics Laboratory, Delhi
	62390	Institute for Plasma Research, India
	62392	Raja Ramanna Center for Advanced Technology, India
	62393	Inter-University Accelerator Center, India
	62395	IUCAA, Inter-University Center for Astronomy and Astrophysics
	62396	Central Electrochemical Research Institute, India
	62397	Indian Association for the Cultivation of Science
	62707	University of the West Indies
	62823	Kuwait Institute for Scientific Research
	62873	CONICET, National Scientific and Technical Research Council, Argentina
62873	120752	El Leoncito Astronomical Complex
62873	121570	Institute of Physics, Rosario
62873	124146	Research Center for Atmospheric and Sea Sciences, Argentina
62873	226544	Institute for Physics, La Plata
62873	230222	IATE, Theoretical and Experimental Astronomy Institute, Cordoba
62873	243751	Institute for Astrophysics, La Plata
62873	372654	CONICET, Astronomical Institute of Earth and Space Sciences
62873	54485	IAFE, Institute of Astronomy and Space Physics, Buenos Aires
62873	54487	Argentine Institute of Radio Astronomy
62873	62927	Institute for Plasma Physics, Buenos Aires
62873	63019	Center for Scientific and Technological Research, Argentina
62873	63043	Southern Center for Scientific Research, Argentina
	62938	Argentina Ministry of Defence
	63094	DSO National Laboratories, Singapore
	63101	National Applied Research Laboratory Center for High-Performance Computing, Taiwan
	63129	ITRI, Industrial Technology Research Institute, Taiwan
	63225	Nanyang Technological University, Singapore
63225	203287	Singapore-MIT Alliance for Research and Technology Center
	63271	Chien Hsin University, Taiwan
	63283	National Taipei University of Education
	63285	National Taitung University
	63353	National Applied Research Laboratories, Taiwan
	63358	Ling Tung University, Taiwan
	63364	Minghsin University of Science and Technology, Taiwan
	63370	National Formosa University, Taiwan
	63373	National Dong Hwa University, Taiwan
	63374	National Hsinchu University of Education, Taiwan
	63403	Ministry of Economic Affairs, Taiwan
63403	63407	Central Geological Survey, Taiwan
	63497	Vanung University, Taiwan
	63526	Cairo University
63526	A1695	Cairo University, Department of Astronomy
	63541	University of Iceland
	63572	Lebanese University
	63579	Ss Cyril and Methodius University
	63596	University of Karachi, Pakistan
	64007	Isik University
	64023	TUBITAK, Scientific and Technological Research Council of Turkey
64023	A1421	Feza Gursey Institute of Physics
64023	A1424	Turkish National Observatory
	64072	Cag University
	64386	DWD, German National Meteorological Service
	64391	University of Akureyri
	64396	Iceland Institute of Natural History
	64401	Reykjavik University
	64733	University of Indonesia
	64750	LIPI, Indonesian Institute of Sciences
64750	186339	National Institute of Aeronautics and Space, Indonesia
64750	215236	BPPT, Agency for the Assessment and Application of Technology, Indonesia
64750	340978	BRKP, Agency for Marine and Fisheries Research, Indonesia
64750	A1523	BMKG, Institute of Meteorology and Geophysics, Indonesia
	64784	Canberra Deep Space Communications Complex
	64883	Samara State University
	64890	Blagoveshchensk State Pedagogical University
	64897	Volgograd State Pedagogical University
	64900	Altai State University
	64902	Bashkir State University
64902	387265	Sterlitamak State Pedagogical Academy
	64909	Chelyabinsk State University
	64915	Far Eastern State University
	64920	Kant Baltic State University, Kaliningrad
	64922	Kazan State University
64922	A1464	Kazan State University, Department of Astronomy
	64935	MSU, Moscow State University
64935	124208	MSU, Sternberg Astronomical Institute
64935	133936	MSU, Institute of Nuclear Physics
64935	133937	MSU, Department of Physics and Astronomy
64935	324908	MSU, Bogoliubov Institute for Theoretical Problems of Mechanics
64935	A1447	Moscow State University, Crimea
	64937	Nizhny Novgorod State University
	64941	Novosibirsk State University
	64948	People's Friendship University of Russia
	64949	Perm State University
	64958	Saratov State University
	64966	Syktyvkar State University
	64969	Tomsk State University
	64970	Tver State University
	64972	Udmurt State University
	64973	Ulyanovsk State University
	64974	Ural State University
	64975	Vladimir State University
	64977	Volgograd State University
	64978	Voronezh State University
	64979	North-Eastern Federal University, Yakutsk
	64980	Yaroslavl State University
	64994	Irkutsk State Technical University
	64998	Udmurt State Technical University
	64999	Kazan Technical University
	65000	Kazan State Technical University
	65011	Moscow Aviation Institute
	65014	Moscow Institute of Physics and Technology
	65024	Moscow State Technical University
	65025	Moscow State Technical University of Civil Aviation
	65031	Moscow State University of Geodesy and Cartography
	65034	Murmansk State Technical University
	65035	Novgorod State Technical University
	65050	Russian State Hydrometeorological University
	65055	Samara State Aerospace University
	65056	Samara State Technical University
	65058	Saratov State Technical University
	65060	Siberian State Technological University
	65064	Saint Petersburg Electrotechnical University
	65065	Saint Petersburg University of Aerospace Instrumentation
	65066	Saint Petersburg State Marine University
	65067	Saint Petersburg State Mining Institute
	65068	Saint Petersburg State Technical University
	65071	State Institute of Fine Mechanics and Optics
	65078	Tomsk State Technical University
	65285	University Tunku Abdul Rahman, Malaysia
	65289	Malaysia University of Science and Technology
	65361	Kongju National University, Korea
	65408	Korea Research Institute of Standards and Science
	65419	Gwangju Institute of Science and Technology, Korea
	65450	Kunsan National University, Korea
	65464	Daejin University, Korea
	65483	Catholic University of Pusan, Korea
	65490	Daejeon Institute of Science and Technology, Korea
	65524	Korea Air Force Academy
	65563	Korea Environment Institute
	65678	ETRI, Electronics and Telecommunications Research Institute, Korea
	65679	Korea Institute of Geoscience and Mineral Resources
	65683	Ulsan University, Korea
	66172	Academy of Sciences, Florence
	66280	Qingdao University of Science and Technology, China
	66331	Sichuan Normal University, China
	66339	Suzhou University of Science and Technology, China
	66343	Yunnan Normal University, China
	66344	Zhejiang Normal University, China
	66350	Chang An University, China
	66359	Dali University, China
	66360	Yuxi Normal University, China
	66447	Hebei Normal University, China
	66449	Harbin University, China
	66479	Nantong University, China
	66486	Huaihai Institute of Technology, China
	66515	Guilin University of Technology, China
	66519	Henan Normal University, China
	66523	Liaoning Normal University, China
	66559	Jiaxing University, China
	66564	Chongqing University of Science and Technology, China
	66573	Institute of Space Technology, Islamabad
	66715	COMSATS Information of Technology, Islamabad
	66746	Federal Urdu University of Arts Sciences and Technology, Pakistan
	66757	Quaid-i-Azam University, Pakistan
	66778	PIEAS, Pakistan Institute of Engineering and Applied Sciences
	66843	NED University of Engineering and Technology, Karachi
	66847	SUPARCO, Pakiston Space and Upper Atmosphere Research Commission
	66851	Sir Syed University of Engineering and Technology, Karachi
	66877	Forman Christian College, Pakistan
	66878	Government College University Lahore, Pakistan
	66901	University of Central Punjab
	66906	University of the Punjab
	66914	University of Engineering and Technology, Lahore
	66959	National University of Sciences and Technology, Islamabad
	66975	Khan Institute of Engineering Sciences and Technology, Pakistan
	67026	Notre Dame University Louaize
	67110	Bedford Institute of Oceanography, Canada
	67129	Canadian National Institute of Optics
	67181	Kumamoto Institute of Technology, Japan
	67181	Soka University, Japan
	67420	Polytechnic School of University of Sao Paulo
	67655	Paraiba Valley University, Brazil
	67714	Federal University of Pelotas, Brazil
	67824	Federal University of Goias, Brazil
	67826	Federal University of Mato Grosso, Brazil
	67828	Federal University of Sao Carlos, Brazil
	67836	State University of Feira de Santana, Brazil
	67843	State University of Ceara, Brazil
	67883	State University of Ponta Grossa, Brazil
	67891	University of Taubate, Brazil
	67892	Federal University of Amazonas, Brazil
	67920	Federal University of the Rio Grande, Brazil
	67994	King Mongkut's University of Technology, Bangkok
	68004	Mae Fah Luang University, Thailand
	68052	Ubon Ratchathani University, Thailand
	68106	Islamic Azad University, Iran
68106	A1516	Islamic Azad University, Department of Physics
	68257	Bu Ali Sina University, Iran
	68259	Shahrood University of Technology, Iran
	68260	Sharif University of Technology
	68311	Tezukayama University, Japan
68434	104647	RAS, Institute of Biophysics
68434	104668	RAS, Institute of Applied Physics, Novgorod
68434	104683	RAS, Institute of Nuclear Physics, Novosibirsk
68434	133875	RAS, Vinogradov Institute of Geochemistry
68434	133905	RAS, Institute of Solar Terrestrial Physics
68434	133909	RAS, Institute of the Earth's Crust
68434	133940	Saint Petersburg State University, Astronomical Institute
68434	196706	RAS, United Institute of Geology, Geophysics and Mineralogy
68434	291262	RAS, Geophysical Service, Obninsk
