	12523	Tianjin Normal University, China
	12526	South China Agricultural University
	12530	Sichuan University, China
	12534	Nanjing Normal University, China
	12538	Nankai University, China
	12544	Shanghai Normal University, China
	12561	Henan Polytechnic University, China
	12563	Hubei University, China
	12564	China University of Geosciences, Wuhan
	12565	Wuhan University of Technology, China
	12568	Hunan Normal University, China
	12569	Hunan University, China
	12570	Central South University, China
	12571	Central South University of Forestry and Technology, China
	12575	Hunan Agricultural University, China
	12576	Inner Mongolia University
	12579	Southeast University, China
	12581	Nanjing University, China
12581	A1568	Nanjing University, Department of Astronomy
12581	A1569	Nanjing University, Department of Physics
12581	A1570	Nanjing University, Department of Earth Sciences
	12582	Soochow University, China
	12589	Shandong University, China
12589	154528	Shandong University at Weihai, China
	12591	Ocean University of China
	12593	Qingdao University, China
	12599	University of Electronic Science and Technology, China
	12604	Chinese Academy of Engineering Physics
12604	71037	Institute of Applied Physics and Computational Mathematics, Beijing
	12605	Tianjin University, China
	12606	Hebei University of Technology, China
	12624	Zhejiang University of Technology, China
	12626	Hangzhou Dianzi University, China
	12633	Beihang University of Aeronautics and Astronautics
	12635	Yunnan University, China
	12636	Zhengzhou University, China
	12651	China Electronics Technology Group Corporation
12651	124162	China Research Institute of Radio Wave Propagation
	12652	University of Science and Technology of China
12652	A1563	University of Science and Technology of China, Department of Astronomy
12652	A1564	University of Science and Technology of China, Department of Earth and Space Sciences
	12655	East China Normal University, Shanghai
	12657	Northwest University, China
	12663	China Aerospace Science and Technology Corporation
12663	118153	China Academy of Space Technology
	12664	Guangxi University, China
	12665	Xiangtang University, China
	12676	Jiangsu University, China
	12682	Yantai University, China
	12683	Jimei University, China
	12686	Guizhou Normal University, China
	12687	Bohai University, China
	12695	Fujita Health University, Japan
	12696	Ritsumeikan University, Japan
	12698	Aoyama Gakuin University, Japan
12698	A1600	Aoyama Gakuin University, Department of Physics
	12700	Aichi University of Education, Japan
	12707	Aichi University, Japan
	12708	Nara Institute of Technology, Japan
	12709	Aichi University of Technology, Japan
	12712	Akita University, Japan
	12716	Aomori University, Japan
	12718	Asahikawa College of Technology, Japan
	12720	Asahi University, Japan
	12737	Chiba University, Japan
12737	A1633	Chiba University, Department of Physics
	12740	Chubu University, Japan
	12744	University of Hyogo, Japan
	12745	Chukyo University, Japan
	12751	Tokyo Denki University
	12754	Hokkaido Information University, Japan
	12755	Dokkyo University, Japan
	12757	Doshisha University, Japan
	12760	Ehime University, Japan
12760	A1637	Ehime University, Research Center for Space and Cosmic Evolution
12760	A1638	Ehime University, Department of Earth Sciences
12760	A1639	Ehime University, Department of Physics
	12772	Fukuoka University of Education, Japan
	12774	Fukuoka University, Japan
	12776	Fukushima University, Japan
	12780	Gakushuin University, Japan
	12785	Gifu University, Japan
	12794	Nihon Fukushi University, Japan
	12794	Nippon Fukushi University, Japan
	12800	Hirosaki University, Japan
	12801	Hiroshima City University, Japan
	12803	Hiroshima University, Japan
12803	427258	Hiroshima University, Department of Physics
12803	A1631	Hiroshima University, Astrophysical Science Center
12803	A1632	Hiroshima University, Department of Earth and Planetary Science
	12804	Hitotsubashi University, Japan
	12808	Hokkai Gakuen University, Japan
	12810	Hokkaido University, Japan
12810	A1610	Hokkaido University, Department of Earth and Planetary Science
12810	A1611	Hokkaido University, Department of Physics
12810	A1612	Hokkaido University, Institute of Seismology and Volcanology
12810	A1613	Hokkaido University, Institute of Cosmosciences
	12814	Hosei University, Japan
	12817	Hyogo University, Japan
	12818	Hyogo College of Medicine, Japan
	12819	Ibaraki University, Japan
12819	A1634	Ibaraki University, Institute for Astrophysics and Planetary Sciences
	12823	International Christian University, Japan
	12826	Kyushu Sangyo University, Japan
	12829	Chiba Institute of Technology, Japan
	12833	Iwate Medical University, Japan
	12836	Iwate University, Japan
	12845	Joetsu University of Education, Japan
	12849	Japan Women's University
	12850	Kagawa University, Japan
	12851	Kagoshima University, Japan
12851	A1641	Kagoshima University, Department of Physics and Astronomy
	12852	Kanagawa Institute of Technology, Japan
	12853	Kanagawa University, Japan
	12856	Kanazawa Institute of Technology, Japan
	12858	Kanazawa University, Japan
12858	300662	Kanazawa University, School of Natural Science and Technology
12858	A1635	Kanazawa University, Department of Earth Sciences
12858	A1636	Kanazawa University, Department of Physics
	12860	Kansai University, Japan
	12867	Kyoto City University of Arts, Japan
	12869	Keio University, Japan
	12872	Kinki University, Japan
	12875	Kyoto Institute of Technology, Japan
	12877	Kitasato University, Japan
	12879	Kibi International University, Japan
	12885	Kobe University, Japan
12885	A1596	Kobe University, Center for Planetary Science
12885	A1597	Kobe University, Department of Physics
	12888	Kochi University, Japan
	12892	Kokugakuin University, Japan
	12893	Kokushikan University, Japan
	12907	Kwansei Gakuin University, Japan
	12915	Kyoto Gakuen University, Japan
	12916	Kyoto Pharmaceutical University, Japan
	12918	Kyoto University, Japan
12918	198755	Kyoto University, Institute for Geothermal Sciences
12918	234959	Kyoto University, Department of Earth and Planetary Sciences
12918	68336	Kyoto University, Department of Physics and Astronomy
12918	73804	Kyoto University, Disaster Prevention Research Institute
12918	88362	Kyoto University, Institute for Sustainable Humanosphere
12918	A1581	Kyoto University, Yukawa Institute for Theoretical Physics
12918	A1582	Kyoto University, Department of Geophysics
12918	A1583	Kyoto University, Hida and Kwasan Observatories
12918	A1584	Kyoto University, Center for Space Studies
12918	A1585	Kyoto University, Radio Atmospheric Science Center
	12919	Kyoto Women's University, Japan
	12923	Kyushu University, Japan
12923	A1622	Kyushu University, Department of Earth and Planetary Sciences
12923	A1623	Kyushu University, Space Environment Research Center
12923	A1624	Kyushu University, Department of Physics
	12924	Kyushu University of Technology, Japan
	12925	Gunma University, Japan
	12930	Matsue National College of Technology, Japan
	12936	Osaka City University, Japan
	12938	Shimane University, Japan
	12939	Meiji University, Japan
	12940	Meiji Gakuin University, Japan
	12942	Meijo University, Japan
	12944	Tokyo Metropolitan University
12944	A1625	Tokyo Metropolitan University, Department of Physics
	12946	Mie University, Japan
	12948	Miyagi University of Education, Japan
	12952	Miyazaki University, Japan
	12961	Nagasaki University, Japan
	12963	Nagoya City University, Japan
	12965	Nagoya University, Japan
12965	198771	Nagoya University, Solar Terrestrial Environment Laboratory
12965	318751	Nagoya University, Department of Earth and Environmental Studies
12965	A1593	Nagoya University, Department of Physics and Astrophysics
12965	A1594	Nagoya University, Institute for the Origin of Particles and the Universe
	12967	Nara Medical University, Japan
	12969	Nara Women's University, Japan
	12970	Naruto University of Education, Japan
	12976	Nihon University, Japan
	12978	Niigata University, Japan
	12982	Nagoya Institute of Technology, Japan
	12992	Ochanomizu University, Japan
	12995	Oita University, Japan
	12997	Okayama University, Japan
12997	133691	Okayama University, Institute for Study of the Earth's Interior
	13003	Meisei University, Japan
	13004	Osaka Electro-Communication University, Japan
	13007	Osaka Gakiun University, Japan
	13009	Osaka Kyoiku University, Japan
	13011	Osaka Sangyo University, Japan
	13013	Osaka University, Japan
13013	A1586	Osaka University, Department of Earth and Space Studies
13013	A1587	Osaka University, Research Center for Nuclear Physics
13013	A1588	Osaka University, Department of Physics
13013	A1589	Osaka University, Institute of Laser Engineering
	13019	Okayama University of Science, Japan
	13022	Rakuno Gakuen University, Japan
	13024	Rikkyo University, Japan
	13025	Rissho University, Japan
	13027	Ryukoku University, Japan
	13030	Saga University, Japan
	13032	Saitama University, Japan
	13033	Hokkaido University of Education, Japan
	13038	Musashi University, Japan
	13045	Senshu University, Japan
	13052	Shiga University, Japan
	13056	Shinshu University, Japan
	13063	Shumei University, Japan
	13065	Saitama Institute of Technology, Japan
	13070	Sophia University, Japan
	13075	Kobe Women's University, Japan
	13088	Takushoku University, Japan
	13089	Tamagawa University, Japan
	13094	Teikyo University, Japan
	13097	Tokyo University of Technology
	13100	Tokyo Medical and Dental University
	13101	Tohoku University, Japan
13101	221508	Tohoku University, Department of Earth Sciences
13101	427701	Tohoku University, Department of Physics
13101	84063	Tohoku University, Institute for Materials Research
13101	A1579	Tohoku University, Astronomical Institute
13101	A1580	Tohoku University, Department of Geosciences
	13103	Toho University, Japan
	13104	Tohoku Institute of Technology, Japan
	13107	Tokiwa University, Japan
	13109	Tokushima University, Japan
	13114	Tottori University, Japan
	13115	Tokyo University of Pharmacy and Life Sciences
	13117	Toyo University, Japan
	13120	Tsuda College, Japan
	13121	University of Tsukuba, Japan
13121	A1603	University of Tsukuba, Department of Physics
13121	A1604	University of Tsukuba, Department of Geosciences
	13122	Tsuru University, Japan
	13125	Tokyo University of Agriculture
	13130	Tokyo Womans Christian University
	13132	Aizu University, Japan
	13133	University of Electro-Communications, Japan
	13135	Tokyo Gakugei University, Japan
	13137	University of Occupation and Environmental Health, Japan 
	13140	Shizuoka University, Japan
	13141	Shiga Prefecture University, Japan
	13142	Tokai University, Japan
13142	52762	Kyushu Tokai University, Japan
13142	A1626	Tokai University, Department of Physics
	13143	University of Tokyo
13143	105219	University of Tokyo, Graduate School of Frontier Sciences
13143	111073	University of Tokyo, Institute of Astronomy
13143	133696	University of Tokyo, Institute for Cosmic Ray Research
13143	133718	University of Tokyo, Department of Physics
13143	133719	University of Tokyo, Department of Applied Physics
13143	234975	University of Tokyo, Department of Earth and Planetary Environmental Science
13143	305779	University of Tokyo, Department of Astronomy
13143	98988	University of Tokyo, Earthquake Research Institute
13143	A1616	University of Tokyo, Department of Earth Science and Astronomy
13143	A1617	University of Tokyo, Kavli Institute for the Physics and Mathematics of the Universe
13143	A1618	University of Tokyo, Research Center for the Early Universe
13143	A1619	University of Tokyo, Atmosphere and Ocean Research Institute
13143	A1620	University of Tokyo, Center for Nuclear Study
13143	A1621	University of Tokyo, Center for Climate System Research
13143	A1627	University of Tokyo, Geophysical Institute
	13144	Utsunomiya University, Japan
	13146	Wakayama University, Japan
	13148	Waseda University, Japan
13148	214339	Waseda University, Advanced Research Institute for Science and Engineering
13148	A1609	Waseda University, Department of Physics and Astronomy
	13149	Yamagata University, Japan
	13150	Yamaguchi University, Japan
	13153	Yamanashi Gakuin University, Japan
	13154	Yokohama National University, Japan
	13155	Yokohama City University, Japan
	13160	Akita Junior University, Japan
	13177	Graduate University for Advanced Studies, Japan
13177	A1578	Graduate University for Advanced Studies, Department of Astronomical Science
13177	A1601	Graduate University for Advanced Studies, Department of Space and Astronautical Science
13177	A1602	Graduate University for Advanced Studies, Department of Particle and Nuclear Physics
	13187	Open University of Japan
	13192	Kagoshima National College of Technology, Japan
	13202	Konan University, Japan
	13205	Kumamoto University, Japan
	13218	Keizai University, Japan
	13221	Nara Prefectural University, Japan
	13251	Saitama Prefectural University, Japan
	13284	Tohoku Gakuin University, Japan
	13290	Tokyo Institute of Technology, Ookayama
13290	374360	Tokyo Institute of Technology, Department of Physics
13290	A1614	Tokyo Institute of Technology, Department of Earth and Planetary Science
	13295	Tokyo Metropolitan College of Industrial Technology
	13299	Tsuroka National College of Technology, Japan
	13307	Yamagata Women's Junior College, Japan
	13311	Osaka Prefecture University, Japan
	13312	Nara University of Education, Japan
	13313	Osaka University of Health and Sports Sciences, Japan
	13314	National Defense Academy, Japan
	13317	Muroran Institute of Technology, Japan
	13329	Central Research Institute of Electric Power Industry, Japan
	13501	Japan Science and Technology Agency
	13506	NICT, National Institute of Information and Communications Technology
	13332	Fujitsu, Ltd
	13480	Hitachi, Ltd
13506	119127	NICT, Space Research Center
13506	A1592	Radio Research Laboratories, Japan
	13508	National Institute of Advanced Industrial Science and Technology, Sansoken
13508	119882	National Institute of Advanced Industrial Science and Technology, Geological Survey of Japan
13508	73459	National Institute of Advanced Industrial Science and Technology, Tsukuba
	13514	International Research Center for Japanese Studies, Kyoto
	13520	National Institute of Radiological Sciences, Japan
	13532	Research Organization of Information and Systems, Japan
13532	13507	Institute of Statistical Mathematics, Japan
13532	13513	National Institute for Informatics, Japan
	13534	National Building Research Institute, Japan
	13551	KEK, High Energy Accelerator Research Organization
	13554	NIPR, National Institute for Polar Research, Japan
	13557	JAXA, Japan Aerospace Exploration Agency
13557	133622	JAXA, Institute of Space and Astronautical Science
13557	222895	JAXA, Earth Observation Research Center
13557	A1599	JAXA, Aerospace Research and Development Directorate
	13570	JAMSTEC, Japan Marine Science and Technology Center
13570	133695	JAMSTEC, Kochi Institute for Core Sample Research
13570	A1605	JAMSTEC, Institute for Research on Earth Evolution
13570	A1606	JAMSTEC, Center for Deep Earth Exploration
13570	A1607	JAMSTEC, Earth Simulator Center
13570	A1608	JAMSTEC, Frontier Research Center for Global Change
	13585	NIES, National Institute for Environmental Studies
	13588	National Museum of Nature and Science, Japan
	13589	National Institute for Agro Environmental Studies, Japan
	13592	NINS, National Institutes of Natural Sciences, Japan
13592	52752	NAOJ, National Astronomical Observatory of Japan
13592	A1595	National Institute for Molecular Science, Japan
	13593	RIKEN, Japan
13593	375236	RIKEN, Institute of Physical and Chemical Research
13593	A1590	RIKEN, Astrophysics Laboratory
13593	A1591	RIKEN, Cosmic Radiation Laboratory
13593	A1642	JASRI, Japan Synchrotron Radiation Research Institute
	13913	Ashikaga Institute of Technology
	14309	Andreas Eckart University of Cologne
14309	199858	University of Cologne, Institute for Theoretical Physics
14309	240183	University of Cologne, Institute for Geophysics
14309	54290	University of Cologne, Institute for Physics
14309	A1495	University of Cologne, Institute for Planetary Research
	14311	Technical University of Dortmund
	14312	University of Siegen
14589	A1121	University of Illinois, Urbana-Champaign, Department of Astronomy
14589	A1122	University of Illinois, Urbana-Champaign, National Center for Supercomputing Applications
14589	A1123	University of Illinois, Urbana-Champaign, Department of Physics
14589	A1124	University of Illinois, Urbana-Champaign, Department of Geology
	14643	Baylor University
14643	A1339	Baylor University, Center for Astrophysics Space Physics and Engineering Research 
	14654	University of Guanajuato, Mexico
14654	113847	University of Guanajuato, Institute of Physics
14654	A1723	University of Guanajuato, Department of Astronomy
	14655	University of Chile
14655	111299	University of Chile, Department of Astronomy
14655	124147	National Astronomical Observatory, Chile
14655	419962	University of Chile, Department of Geophysics
14655	A1711	University of Chile, Department of Physics
	14658	University of Arkansas, Little Rock
14658	A1105	University of Arkansas, Little Rock, Department of Physics
14658	A1106	University of Arkansas, Little Rock, Center for Space and Planetary Science
	14660	University of Arkansas, Pine Bluff
	14684	Indiana University, Kokomo
	14686	Indiana University, South Bend
	14719	University of Nebraska, Lincoln
14719	A1109	University of Nebraska, Lincoln, Department of Physics and Astronomy
	14720	University of Nebraska, Omaha
14722	A1176	University of Nevada, Las Vegas, Department of Physics and Astronomy
14736	168601	Texas A&M University, College Station, Department of Physics and Astronomy
14736	171873	Texas A&M University, College Station, Department of Geology and Geophysics
14751	A1128	University of Wisconsin, Milwaukee, Center for Gravitation Cosmology and Astrophysics
14751	A1129	University of Wisconsin, Milwaukee, Department of Physics
	14915	University of Hamburg
14915	153609	University of Hamburg, Department of Physics
14915	417737	University of Hamburg, Institute for Theoretical Physics
14915	54264	University of Hamburg, Hamburg Observatory
14915	A1500	University of Hamburg, Institute for Experimental Physics
	15550	Janes Hutton Institute
	15585	Science and Technology Facilities Council
15585	42207	Royal Observatory Edinburgh
15585	97008	RAL, Rutherford Appleton Laboratory
	15618	Georgia College and State University
	15619	Edinboro University
	15663	Utica College
	16345	University of San Pablo, Spain
	16379	CSIC, Consejo Superior de Investigaciones Cientificas
16379	120422	CAB, Center for Astrobiology, Madrid
16379	16625	Museum of Natural Sciences, Madrid
16379	172281	ICFO, Institute for Photonic Sciences, Barcelona
16379	172283	Institute of Physics, Cantabria
16379	203227	IFT, Institute of Theoretical Physics, Madrid
16379	317277	IEEC, Institute of Space Studies, Catalona
16379	54341	Institute of Marine Sciences, Barcelona
16379	54395	Institute of Space Sciences, Barcelona
16379	54399	CEAB, Center for Advanced Studies of Blanes
16379	54408	Institut de Fisica Corpuscular, Valencia
16379	54412	Institute of Astrophysics of Andalusia
16379	54435	Ebro Observatory
16379	54445	Institute of Earth Sciences of Andalusia
16379	54456	INTA, Spanish Institute for Aerospace Technologies
16379	59540	IEM, Institute for Structural Materials, Madrid
16379	73054	Institute of Earth Sciences, Barcelona
16379	73080	Institute of Geophysics of Andalusia
16379	82825	Institute of Microelectronics, Barcelona
16379	83098	IPNA, Instituto de Productos Naturales y Agrobiologia
16379	A1316	IFAE, Institute for High Energy Physics, Barcelona
16379	A1320	Institute of Astronomy and Geophysics, Madrid
16379	A1324	LAEFF, Laboratory for Space Astrophysics and Theoretical Physics
16379	A1325	Institute of Mathematics and Fundamental Physics, Madrid
16379	A1336	CEFCA, Center for Research in Astrophysics and Cosmology, Aragon
	16402	University of the Basque Country
16402	A1331	University of the Basque Country, Department of Physics
	16532	Institute of Catalan Studies
	16535	Spanish Institute of Oceanography
	16541	Spanish Institute of Geology and Minerals
	16718	University of Alacant
	16719	Autonomous University of Barcelona
16719	172281	ICFO, Institute for Photonic Sciences, Barcelona
16719	317277	IEEC, Institute of Space Studies, Catalona
16719	54341	Institute of Marine Sciences, Barcelona
16719	54395	Institute of Space Sciences, Barcelona
16719	73054	Institute of Earth Sciences, Barcelona
16719	82825	Institute of Microelectronics, Barcelona
16719	A1316	IFAE, Institute for High Energy Physics, Barcelona
	16720	University of Alcala
	16721	University of Almeria
	16722	Autonomous University of Madrid
16722	A1322	Autonomous University of Madrid, Department of Physics
	16724	University of Barcelona
16724	117370	ICREA, Institucio Catalona de Recerca i Estudis Avancats
16724	203269	Catalan Institute of Climate Sciences
16724	223309	University of Barcelona, Department of Physics
16724	317277	IEEC, Institute of Space Studies, Catalona
16724	368914	University of Barcelona, Department of Astronomy and Meteorology
16724	54341	Institute of Marine Sciences, Barcelona
16724	54395	Institute of Space Sciences, Barcelona
16724	73054	Institute of Earth Sciences, Barcelona
16724	A1329	ICC, Institute of Cosmic Sciences, Barcelona
	16725	University of Burgos
	16726	University of Madrid
16726	203227	IFT, Institute of Theoretical Physics, Madrid
	16727	University of Cadiz
	16733	University of Castilla-La Mancha
	16734	Complutense University of Madrid
16734	213131	Complutense University of Madrid, Department of Physics
16734	A1320	Institute of Astronomy and Geophysics, Madrid
16734	A1323	Complutense University of Madrid, Department of Astronomy
	16735	University of Cordoba
	16737	University of Coruna
	16738	University of Girona
	16739	University of Lleida
	16740	European University of Madrid
	16741	University of Granada
16741	73080	Andalusian Institute of Geophysics
16741	A1317	University of Granada, Department of Physics
	16743	University of Huelva
	16745	University of the Balearic Islands
16745	A1334	Astronomical Observatory of Mallorca
	16747	University of Jaen
16747	A1332	University of Jaen, Department of Physics
	16748	Jaume I University
	16749	University of La Laguna
16749	223323	University of La Laguna, Department of Physics
16749	A1308	University of La Laguna, Department of Astrophysics
16749	A1309	IAC, Astrophysical Institute of the Canaries
	16750	University of Las Palmas
	16751	University of Murcia
	16752	University of Malaga
	16753	University of Miguel Hernandez de Elche
	16754	Public University of Navarra, Pamplona
	16757	National University of Distance Education
	16759	University of Extremadura
	16760	International University of Catalunya
	16761	University of Cantabria
16761	172283	Institute of Physics, Cantabria
	16763	University of Oviedo
	16764	University of La Rioja
	16765	University of Zaragoza
	16767	Technical University of Catalona
16767	A1328	Technical University of Catalona, Department of Physics
	16769	Technical University of Cartagena
	16771	Technical University of Madrid
	16774	Technical University of Valencia
	16776	King Juan Carlos University, Madrid
	16777	University of Rovira and Virgili
	16778	University of Sevilla
	16779	University of Salamanca
	16780	University of Santiago de Compostela
	16781	University of Valencia
16781	54408	Institut de Fisica Corpuscular, Valencia
16781	A1318	University of Valencia, Department of Astronomy and Astrophysics
16781	A1319	University of Valencia, Department of Physics
	16782	University of Valladolid
	16784	University of Vigo
	17046	Mount San Antonio College
	17067	City College of San Francisco
	17104	WMO, World Meteorological Organization
	17157	DARPA, Defense Advanced Research Projects Agency
	17212	Idaho National Laboratory
	17221	Thomas Jefferson National Accelerator Facility
	17942	Ministry of Education University and Research
	18114	ENEA, Italian National Agency for New Technologies, Energy and Sustainable Development
	18251	INFN, Italian National Institute of Nuclear Physics
18251	111222	INFN, Italian National Institute of Nuclear Physics, Ferrara
18251	119608	INFN, Italian National Institute of Nuclear Physics, Trieste
18251	124218	INFN, Italian National Institute of Nuclear Physics, Catania
18251	154896	University of Siena, Department of Physics and Earth Sciences
18251	154899	Sapienza University, Department of Physics
18251	18258	INFN, Italian National Institute of Nuclear Physics, Legnaro
18251	18473	ICTP, Abdus Salam International Center for Theoretical Physics
18251	201836	INFN, Italian National Institute of Nuclear Physics, Lecce
18251	226477	INFN, Italian National Institute of Nuclear Physics, Trento
18251	385891	University of Salerno, Department of Physics
18251	388422	Roma Tre University, Department of Mathematics and Physics
18251	415682	INFN, Italian National Institute of Nuclear Physics, Pisa
18251	97028	INFN, Italian National Institute of Nuclear Physics, Frascati
18251	97029	Italian National Laboratory South, Catania
18251	97030	INFN, Gran Sasso National Laboratory, L'Aquila
18251	A1377	Tor Vergata University, Department of Physics
18251	A1387	INFN, Italian National Institute of Nuclear Physics, Florence
18251	A1388	INFN, Italian National Institute of Nuclear Physics, Torino
18251	A1389	INFN, Italian National Institute of Nuclear Physics, Genoa
18251	A1393	INFN, Italian National Institute of Nuclear Physics, Perugia
18251	A1396	INFN, Italian National Institute of Nuclear Physics, Cosenza
18251	A1401	INFN, Italian National Institute of Nuclear Physics, Pavia
18251	A1403	INFN, Italian National Institute of Nuclear Physics, Bologna
18251	A1404	INFN, Italian National Institute of Nuclear Physics, Milan
18251	A1405	INFN, Italian National Institute of Nuclear Physics, Cagliari
18251	A1407	INFN, Italian National Institute of Nuclear Physics, Bari
18251	A1408	INFN, Italian National Institute of Nuclear Physics, Padua
18251	A1409	INFN, Italian National Institute of Nuclear Physics, Naples
