	A1004	Arecibo Observatory
	A1025	Saint Michael's College
	A1058	Florida International University
	A1072	American Astronomical Society
	A1118	Adler Planetarium
	A1135	Atmospheric & Space Technology Research Associates (ASTRA), San Antonio
	A1146	Space Science Institute 
	A1151	Palmer Divide Observatory
	A1159	Center for Backyard Astronomy
	A1161	Planetary Science Institute
	A1200	Malin Space Science Systems, San Diego
	A1206	Stanford Research Institute
	A1240	FOM, Institute for Plasma Physics
	A1242	Belgian Institute for Space Aeronomy
	A1245	Belgium Astronomical Association
	A1247	European Center for Geodynamics and Seismology
	A1269	Observatoire de Blauvac
	A1270	CSEM, Centre Suisse d'Electronique et de Microtechnique
	A1273	GANIL, Grand Accelerateur National d'Ions
	A1281	Institut Superieure de l'Aeronautique et de l'Espace
	A1285	SPACE X Exploration Institute
	A1290	ISSI, International Space Science Institute
	A1297	Swiss Federal Observatory, Zurich
	A1302	Norwegian Geological Society
	A1304	EISCAT, European Incoherent Scatter Scientific Association
	A1306	Atalaia Group Crow Observatory
	A1307	NUCLIO, Interactive Nucleus of Astronomy
	A1312	ASTER, Amateur Astronomers Association of Barcelona
	A1313	Fabra Observatory, Barcelona
	A1314	Esteve Duran Observatory, Barcelona
	A1315	Gualba Observatory, Barcelona
	A1327	Royal Spanish Naval Observatory
	A1330	Catalan Physics Society
	A1335	FRACTAL, SNLE
	A1338	Astronomical Society of Croatia
	A1341	Astronomical Society of Slovenia
	A1344	Isaac Newton Institute, Chile
	A1350	Hungarian Astronomical Association
	A1351	Bolyai Military University
	A1357	Bucharest Astroclub
	A1363	Stefanik's Observatory, Prague
	A1365	Copernicus Observatory, Brno
	A1367	Upice Observatory
	A1371	Polish Society of Amateur Astronomers
	A1372	Olsztyn Astronomical Observatory
	A1374	Chorzow Astronomical Observatory
	A1381	Observatoire Cantonal de Neuchatel
	A1390	EGO, European Gravitational Observatory, Pisa
	A1402	EURAC, European Academy of Bolzano
	A1412	Astronomical Observatory of Aosta
	A1413	Talmassons Observatory
	A1414	Geological Observatory of Coldigioco
	A1415	Campo Catino Astronomical Observatory
	A1416	ECT, European Center for Theoretical Studies in Nuclear Physics
	A1419	ISI, Institute for Scientific Interchange, Torino
	A1420	Bellatrix Astronomical Observatory
	A1430	Hellenic Military Academy
	A1433	Cyprus College
	A1441	Odessa National Maritime University
	A1451	Belarus State University, Minsk
	A1453	Astronomical Geodesical Society of Minsk
	A1458	Samarkand State University
	A1460	Georgia Technical University, Tbilisi
	A1461	MEPhI, Moscow Engineering Physics Institute
	A1466	EAAS, Eurasian Astronomical Society
	A1468	Khrunichev State Research and Production Space Center
	A1469	Korolev Energia Space Rocket Corporation
	A1470	State Committee of Standards, Moscow
	A1471	Central Aerological Observatory, Dolgoprudnyi
	A1472	Rostov State Pedagogical University
	A1484	German Academy of Sciences, Potsdam
	A1486	Potsdam Meteorological Observatory
	A1487	International Meteor Organization
	A1489	Archenhold Observatory, Berlin
	A1490	BAV, West German Variable Star Observers
	A1491	Max Born Institute for Nonlinear Optics
	A1508	Michael Adrian Observatory, Trebur
	A1517	Geological Survey of Iran
	A1518	Astronomy and Space Research Center, Baghdad
	A1519	Nepal Astronomical Society
	A1521	Philippine Atmospheric Geophysical and Astronomical Services Administration
	A1524	Center for Volcanology and Geohazards, Indonesia
	A1525	BAKOSURTANAL, Indonesia
	A1534	Thailand Center of Excellence in Physics
	A1535	VATLY Institute for Nuclear Science and Technology
	A1543	Nikola Tesla University
	A1546	Assam Science Society, India
	A1548	Government New Science College, India
	A1549	Indian Institute of Physics
	A1550	Nuclear Science Center, New Delhi
	A1559	Radio Research Laboratory, Korea
	A1561	Korea Astronomy Observatory
	A1573	Beijing Planetarium
	A1577	Variable Star Observers League of Japan
	A1598	Kobe Science Museum, Japan
	A1615	Japan Spaceguard Association
	A1630	Japan Space Utilization Promotion Center
	A1640	Gunma Astronomical Observatory, Japan
	A1643	Toyoma Science Museum, Japan
	A1644	Geo Research Institute, Osaka, Japan
	A1645	Osaka Science Museum, Osaka, Japan
	A1646	ALPO, Association for Lunar and Planetary Observers, Japan
	A1647	Misato Astronomical Observatory, Japan
	A1648	Hamanowa Astronomical Observatory, Japan
	A1649	Itagaki Astronomical Observatory, Japan
	A1654	Royal Astronomical Society of New Zealand
	A1655	DSIR, Department of Scientific and Industrial Research, New Zealand
	A1656	Carter Observatory, New Zealand
	A1657	Auckland Observatory
	A1664	Australian Atomic Energy Commission
	A1678	Perth Observatory
	A1680	Sydney Observatory Museum
	A1681	Hunters Hill Observatory
	A1682	AGSO, Australian Geological Survey Organisation
	A1683	Mars Society
	A1684	Australian Bureau of Mineral Resources
	A1685	Australian Museum Sydney
	A1690	SKA, Square Kilometre Array
	A1696	Center for Hydrologic Research, Cameroon
	A1697	Montserrat Volcano Observatory
	A1699	INETER, National Institute for Territorial Studies, Nicaragua
	A1700	Supernova Ltd, British Virgin Islands
	A1701	SPACE, Seminario Permanente de Astronomia y Ciencias
	A1709	Rosario Planetarium and Astronomical Observatory
	A1716	SPACE, San Pedro de Atacama Celestial Explorations
	A1739	Armagh Observatory
	A1750	Canadian Center for Remote Sensing
	A1751	CERCA, Canadian Emergency Response Contractor's Alliance
	A1752	SNOLAB
	A1756	Scottish Universities Research and Reactor Center
	A1786	Nagano National College of Technology, Japan
	A1800	Environmental Research Institute of Michigan
	A1804	American Science and Engineering
	A1810	Interferometrics, Inc.
	A1811	Computational Physics, Inc.
	A1812	Eureka Scientific
	A3003	FINCA, Finnish Centre for Astronomy
	A3005	Swedish Space Corporation
	A3009	EURATOM, European Atomic Energy Community
	A3022	Uppsala Ionospheric Observatory 
	A3023	Icarus Research Inc
	A3024	GATS Inc
A1048	A1165	US Naval Observatory, Flagstaff
A1058	A1059	Florida International University, SARA Observatory
A1146	A1147	Space Science Institute, Cassini Imaging Central Laboratory for Operations
A1153	A1149	National Oceanic and Atmospheric Administration, Boulder, Space Weather Prediction Center
A1271	113461	LSCE, Laboratoire des Sciences du Climat et de l'Environnement
A1271	130008	IPSL, LERMA, Laboratoire d'Etudes du Rayonnement de la Matiere en Astrophysique
A1271	A1280	IPSL, LATMOS, Laboratoire Atmospheres Milieux Observations Spatiales
A1309	A1310	IAC, La Palma Observatories
A1309	A1311	IAC, Tenerife Observatory
A1344	A1343	Isaac Newton Institute of Chile, Belgrade
A1344	A1440	Isaac Newton Institute of Chile, Crimean Branch
A1344	A1462	Isaac Newton Institute of Chile, Russia
A3009	A1373	Institute of Plasma Physics and Laser Microfusion, Warsaw
	1004	Aalborg University
	1006	Aarhus University
1006	123250	Aarhus University, Institute for Physics and Astronomy
1006	86966	Aarhus University, Institute for Geoscience
	1018	Robert Gordon University
	1019	University of Aberdeen
1019	A1755	SUPA, Scottish Universities Physics Alliance
	1023	United States Army
1023	40737	US Army Corps of Engineers
1023	47654	Army Research Laboratory Aberdeen Proving Ground
1023	58217	Army Research Laboratory, Adelphi MD
1023	172344	US Army Research Office, Research Triangle Park, NC
	1026	Aberystwyth University
1026	151346	Aberystwyth University, Institute of Geography and Earth Sciences
1026	151350	Aberystwyth University, Institute of Mathematics and Physics
	1032	Hardin-Simmons University
	1033	McMurry University
	1040	Abo Akademi University
	1044	Ohio Northern University
	1057	South Australian Museum
	1065	Flinders University
	1066	University of Adelaide
1066	A1673	University of Adelaide, School of Physics
1066	A1674	University of Adelaide, School of Earth and Environmental Sciences
	1067	University of South Australia
1068	223100	University of Maryland, Department of Chemistry
1068	248497	University of Maryland, Department of Atmospheric and Oceanic Science
1068	248530	University of Maryland, Department of Physics
1068	248531	University of Maryland, Department of Astronomy
1068	88968	Institute for Physical Science and Technology, UMD College Park
1068	A1045	Center for Research and Exploration in Space Science & Technology
	1069	University System of Maryland
1069	1068	University of Maryland, College Park
1069	12265	University of Maryland, Baltimore County
	1074	US Department of Energy
1074	6865	Pacific Northwest National Laboratory
	1085	State University of New York System
1085	1084	SUNY Albany
1085	12292	SUNY Buffalo
1085	12301	SUNY Stony Brook
1085	14625	SUNY Adirondack
1085	14787	SUNY Binghamton
1085	14788	SUNY Brockport
1085	14792	SUNY Canton
1085	14795	SUNY Cobleskill
1085	14800	SUNY Cortland
1085	14801	SUNY Delhi
1085	14805	SUNY Farmingdale
1085	14808	SUNY Fredonia
1085	14811	SUNY Geneseo
1085	14821	SUNY New Paltz
1085	14825	SUNY Oneonta
1085	14828	SUNY Oswego
1085	14829	SUNY Plattsburgh
1085	14830	SUNY Potsdam
1085	14840	SUNY Purchase
	1097	US Department of Agriculture
	1098	Albion College
	1104	University of New Mexico
1104	A1172	University of New Mexico, Department of Physics and Astronomy
1104	A1173	University of New Mexico, Department of Earth and Planetary Sciences
	1105	Sandia National Laboratories
1105	A1214	Sandia National Laboratories, Livermore
	1109	Charles Sturt University
	1132	Alfred University
	1139	Abilene Christian University
	1142	Grand Valley State University
	1146	Cedar Crest College
	1150	Alma College
	1166	University System of Georgia
1166	1165	Georgia Southwestern State University
1166	124314	Skidaway Institute of Oceanography
1166	1355	University of Georgia
1166	1372	Georgia Institute of Technology
1166	1373	Georgia State University
1166	15609	Southern Polytechnic University
1166	15612	Clayton State University
1166	15614	Valdosta State University
1166	15617	Kennesaw State University
1166	2291	University of West Georgia
1166	2634	Columbus State University
1166	32193	University of North Georgia
	1177	Iowa State University
1177	A1110	Iowa State University, Department of Physics and Astronomy
	1180	Amherst College
1180	A1027	Five College Radio Astronomy Observatory
	1183	Hampshire College
1183	A1027	Five College Radio Astronomy Observatory
	1190	Vrije Universiteit Amsterdam
1190	416511	Vrije Universiteit Amsterdam, Department of Earth Sciences
1190	A1237	Vrije Universiteit Amsterdam, Department of Physics and Astronomy
	1234	Universiteit van Amsterdam
1234	226185	Universiteit van Amsterdam, Institute of Physics
1234	A1238	Universiteit van Amsterdam, Astronomical Institute Anton Pannekoek
	1259	University of Michigan, Ann Arbor
1259	14711	University of Michigan, Dearborn
1259	14712	University of Michigan, Flint
1259	242913	University of Michigan, Ann Arbor, Department of Physics
1259	A1079	University of Michigan, Ann Arbor, Department of Astronomy
1259	A1080	University of Michigan, Ann Arbor, Radio Astronomy Observatory
1259	A1081	University of Michigan, Ann Arbor, Space Physics Research Laboratory
1259	A1082	University of Michigan, Ann Arbor, Department of Atmospheric Oceanic and Space Sciences
1259	A1083	University of Michigan, Ann Arbor, Department of Geological Sciences
	1260	US Environmental Protection Agency
1260	138030	US Environmental Protection Agency, Research Triangle Park
	1263	Bard College
	1268	Saint Johns College, Annapolis
	1270	Saint Francis Xavier University, Canada
	1279	Lawrence University
	1286	California State University System
1286	10695	California State University, Sacramento
1286	1285	Humboldt State University
1286	14662	California State University, Bakersfield
1286	14663	California State University, Chico
1286	14665	California State University, Fresno
1286	14666	California State University, Fullerton
1286	14667	California State University, Hayward
1286	14668	California State University, Long Beach
1286	14669	California State University, Los Angeles
1286	14670	California State University, Monterey Bay
1286	14671	California State University, Northridge
1286	14672	California State University, San Bernardino
1286	14673	California State University, San Marcos
1286	14674	California State University, Turlock
1286	14702	California State University, Dominguez Hills
1286	6647	California State Polytechnic University
1286	6960	Sonoma State University
1286	7117	San Diego State University
1286	7147	San Francisco State University
1286	7161	San Jose State University
1286	7162	Santa Clara University
	1287	Marymount University
	1291	Argonne National Laboratory
1291	A1125	Argonne National Laboratory, Physics Division
	1314	Raytheon Corporation
1314	A1220	Raytheon Corporation, California
1314	A1221	Raytheon Corporation, Maryland
1314	A1222	Raytheon Corporation, Arizona
1314	A1223	Hughes Aircraft
	1319	University of New England Armidale
	1348	Benedictine College
	1349	Athabasca University, Canada
	1354	Ohio University, Athens
1354	A1428	Ohio University, Department of Physics and Astronomy
1355	17219	University of Georgia, Savannah River Laboratory
1355	A1068	University of Georgia, Department of Physics and Astronomy
	1357	Clark Atlanta University
	1371	Emory University
1372	A1063	Georgia Institute of Technology, Center for Relativistic Astrophysics
1372	A1064	Georgia Institute of Technology, Earth and Atmospheric Sciences
1372	A1065	Georgia Institute of Technology, Department of Physics
1373	A1066	Georgia State University, Department of Physics and Astronomy
	1375	Spelman College
	1383	Auburn University
1383	A1100	Auburn University, Department of Physics
	1410	Auckland University of Technology
	1415	University of Auckland
1415	A1652	University of Auckland, Department of Physics
1438	114093	University of California, Berkeley, Department of Earth and Planetary Science
1438	252113	University of California, Berkeley, Department of Physics
1438	A1188	University of California, Berkeley, Department of Astronomy
1438	A1189	University of California, Berkeley, Space Sciences Laboratory
1438	A1190	University of California, Berkeley, Department of Geology and Geophysics
	1439	University of California System
1439	1438	University of California, Berkeley
1439	33244	University of California, Merced
1439	8783	University of California, Los Angeles
1439	8784	University of California, San Diego
1439	8785	University of California, San Francisco
1439	8786	University of California, Santa Barbara
1439	8787	University of California, Santa Cruz
1439	8788	University of California, Irvine
1439	8789	University of California, Davis
1439	8790	University of California, Riverside
	1445	Babson College
	1466	Johns Hopkins University
1466	310920	Johns Hopkins University, Department of Physics and Astronomy
1466	70603	Johns Hopkins, Applied Physics Laboratory
	1485	Carnegie Institution of Washington
1485	230212	Las Campanas Observatory
1485	53520	Carnegie Institution of Washington, Observatories
1485	89017	Carnegie Institution of Washington, Geophysical Laboratory
1485	89019	Carnegie Institution of Washington, Department of Terrestrial Magnetism
1485	A1126	Carnegie Institution of Washington, Argonne National Laboratory
	1490	Goucher College
	1491	Morgan State University
	1492	Towson University
	1506	University College of Bangor
	1555	University of Bath, UK
	1596	Queen's University Belfast
1596	240524	Queen's University Belfast, School of Mathematics and Physics
	1632	Western Washington University
	1634	Notre Dame de Namur University
	1643	Minnesota State University System
1643	38701	Minnesota State University, Bemidji
1643	38703	Minnesota State University, Mankato
1643	38707	Minnesota State University, Winona
1643	5528	Minnesota State University, Saint Cloud
1643	5627	Minnesota State University, Moorhead
	1646	Bennington College
	1649	Curtin University
1649	168274	Curtin University of Technology
1649	A1676	International Centre for Radio Astronomy Research
1649	A1677	Curtin University, Department of Physics
	1652	Berea College
	1658	University of Bergen
1658	A1305	University of Bergen, Department of Physics
	1666	Lawrence Berkeley National Laboratory
1666	A1218	Lawrence Berkeley National Laboratory, Physics Division
	1671	Siemens AG
	1674	Andrews University
	1687	Lehigh University
	1701	Ferris State University
	1705	Montana State University System
1705	33049	Montana State University, Billings
1705	33052	Montana State University, Bozeman
	1711	Indiana University 
1711	A1094	Indiana University, Department of Astronomy
1711	A1095	Indiana University, Department of Physics
	1722	Aston University, UK
	1724	University of Birmingham
1724	152867	University of Birmingham, School of Physics and Astronomy
1724	152868	University of Birmingham, School of Geography, Earth and Environmental Sciences
	1755	UK Ministry of Defense
1755	A1765	DSIR, Department of Scientific and Industrial Research, UK
1755	A1766	Royal Radar Establishment, UK
1755	A1767	Royal Aerospace Establishment, UK
	1757	Virginia Polytechnic Institute and State University
1757	A1807	Virginia Tech, Department of Geosciences
1757	A1808	Virginia Tech, Department of Physics
	1763	Simon Fraser University, Canada
	1770	Illinois Wesleyan University
	1773	Bloomsburg University of Pennsylvania
	1782	Florida Atlantic University
	1791	Boise State University
	1808	Boston College
1808	124351	Boston College, Weston Observatory
1808	205707	Boston College, Department of Geology and Geophysics
1808	372741	Boston College, Department of Chemistry
1808	A1000	Boston College, Department of Physics
1808	A1001	Boston College, Department of Earth and Environmental Studies
1808	A1002	Boston College, Institute for Scientific Research
	1809	Massachusetts State University System
1809	10646	Bridgewater State University
1809	7043	Salem State University
	1810	Tufts University
1810	399918	Tufts University, School of Engineering
1810	A1005	Tufts University, Department of Physics and Astronomy
	1812	Harvard University
1812	124324	Blue Hill Meteorological Observatory
1812	164189	Harvard University, Department of Chemistry
1812	1811	Harvard Medical School
1812	242596	Harvard University, Department of Physics
1812	53785	Harvard Radcliffe Institute for Advanced Study
1812	61814	Harvard Smithsonian Center for Astrophysics
1812	A1034	Harvard College Observatory
1812	A1035	Harvard University Center for Earth and Planetary Physics
1812	A1036	Harvard University, Department of Astronomy
	1828	Wheelock College
	1846	Boston University
1846	168350	Boston University, Department of Geography
1846	169392	Boston University, Center for Remote Sensing
1846	201920	Boston University, Department of Physics
1846	310031	Boston University, Department of Astronomy
1846	310035	Boston University, Department of Earth Sciences
	1848	Northeastern University
1848	195089	Northeastern University, Department of Physics
	1850	Suffolk University
1850	226251	Suffolk University, Madrid
	1851	University of Massachusetts System
1851	14707	UMass Amherst
1851	14708	UMass Boston
1851	14709	UMass Dartmouth
1851	14710	UMass Lowell
	1861	Brigham and Women's Hospital
1877	129418	University of Colorado, Boulder, Department of Aerospace and Engineering
1877	314450	CIRES, Cooperative Institute for Research in Environmental Sciences
1877	315568	University of Colorado, Boulder, Department of Geological Sciences
1877	A1142	University of Colorado, Boulder, Department of Astrophysical and Planetary Sciences
1877	A1143	University of Colorado, Boulder, Laboratory for Atmospheric and Space Physics
1877	A1144	University of Colorado, Boulder, Department of Physics
	1878	University of Colorado System
1878	12226	University of Colorado, Denver
1878	14676	University of Colorado, Colorado Springs
1878	1877	University of Colorado, Boulder
	1879	National Center for Atmospheric Research
1879	A1145	National Center for Atmospheric Research, High Altitude observatory
	1888	Bowling Green State University
	1889	Western Kentucky University
	1905	University of Bradford, UK
	1912	Saint John's College, UK
	1916	Brandon University, Canada
	1938	University of Bridgeport
	1947	University of Brighton, UK
	1948	University of Sussex
1948	152136	University of Sussex, Department of Physics and Astronomy
1948	A1768	SEPnet, South-East Physics Network
	1974	University of Queensland
1974	316549	University of Queensland, School of Earth Sciences
1974	326913	University of Queensland, School of Mathematics and Physics
	1980	University of Bristol, UK
1980	152332	University of Bristol, School of Chemistry
1980	152333	University of Bristol, School of Earth Sciences
1980	152335	University of Bristol, School of Geographical Sciences
1980	152336	University of Bristol, School of Mathematics
1980	152337	University of Bristol, School of Physics
	1992	Roger Williams University
	1994	University of Technology Sydney
	2007	Yeshiva University
	2009	City University of New York
2009	14768	Manhattan Community College
2009	14771	CUNY College of Staten Island
2009	14776	Kingsborough Community College
2009	14780	New York City College of Technology
2009	14781	CUNY Queens College
2009	14782	Queensborough Community College
2009	2037	Brooklyn College
2009	5924	Hunter College
	2010	Manhattan College
	2019	South Dakota State University
	2029	Syracuse University
2029	251768	Syracuse University, Department of Physics
	2044	U.S. Air Force
2044	115768	Kirtland AFB Air Force Research Laboratory
2044	149992	Peterson AFB Air Force Research Laboratory
2044	2611	U.S. Air Force Academy, CO
2044	392352	Wright-Patterson AFB
2044	47794	Air Force Institute of Technology
2044	98976	Hanscom AFB Air Force Research Laboratory
	2045	Long Island University
	2050	Bowdoin College
	2058	Bryn Mawr College
	2059	West Virginia Wesleyan College
	2060	University of Buckingham, UK
	2071	Canisius College
	2080	La Trobe University
2080	428687	La Trobe University, Department of Physics
	2092	University of Vermont
	2104	Deakin University
	2112	Cardiff University
2112	151290	Cardiff University, School of Earth and Ocean Sciences
2112	151301	Cardiff University, School of Physics and Astronomy
2112	A1757	Cardiff University, Center for Astrobiology
	2118	College of Idaho
	2129	University of Calgary
2129	113480	University of Calgary, Department of Geoscience
2129	A1724	University of Calgary, Department of Physics and Astronomy
2129	A1725	University of Calgary, Institute for Space Research
	2152	University of Cambridge, UK
2152	151939	University of Cambridge, Center for Atmospheric Science
2152	151955	University of Cambridge, Institute of Astronomy
2152	151956	University of Cambridge, Department of Physics
2152	53257	University of Cambridge Press
2152	61434	University of Cambridge, Churchill College
2152	61461	University of Cambridge, Trinity College
2152	65899	University of Cambridge, Isaac Newton Mathematical Institute
2152	67366	University of Cambridge, Department of Earth Sciences
	2165	Schlumberger Ltd.
2165	2164	Schlumberger Cambridge Research, Ltd.
2165	318641	Schlumberger Houston, Ltd.
	2167	Massachusetts Institute of Technology
2167	117274	Haystack Observatory
2167	203287	Singapore-MIT Alliance for Research and Technology Center
2167	5763	MIT, Lincoln Laboratory
2167	A1012	MIT, Center for Space Research/Kavli Institute
2167	A1013	MIT, Department of Earth and Planetary Science
2167	A1014	MIT, Department of Physics
2167	A1803	MIT/WHOI Joint Program in Oceanography
	2214	Australian Defence Force Academy
2214	155101	UNSW@ADFA
	2219	ANU, Australian National University, Canberra
2219	111119	ANU, Research School of Physics and Engineering
2219	170547	ANU, Research School of Earth Sciences
2219	217002	ANU, Research School of Astronomy and Astrophysics
2219	310804	ANU, Mount Stromlo and Siding Spring Observatories
	2221	CSIRO, Commonwealth Scientific and Industrial Research Organization
2221	113124	CSIRO, Marine and Atmospheric Research
2221	123968	CSIRO, Australian Telescope National Facility
2221	129603	CSIRO, Division of Radiophysics
2221	206425	CSIRO, Earth Science and Resource Engineering
2221	206428	CSIRO, Astronomy and Space Science
2221	A1675	CASWR, Centre for Australian Weather and Climate Research
	2222	DSTO, Defence Science and Technology Organisation
	2234	University of Canberra
	2240	University of Kent, UK
2240	152102	University of Kent, School of Physical Sciences
2240	152138	University of Kent, Center for Astrophysics and Planetary Science
2240	A1768	SEPnet, South-East Physics Network
	2244	Lincoln University, New Zealand
	2250	Saint Lawrence University
	2251	Southeast Missouri State University
	2254	Southern Illinois University
	2272	Dickinson College
	2281	University of Melbourne
2281	A1671	University of Melbourne, Department of Physics
2281	A1672	University of Melbourne, Department of Earth Sciences
	2310	Universidad de Puerto Rico, San Juan 
2310	16146	Universidad de Puerto Rico, Mayaguez
2310	19850	Universidad de Puerto Rico, Arecibo
2310	19878	Universidad de Puerto Rico, Piedras
	2313	University of Northern Iowa
2331	A1040	Triangle Universities Nuclear Laboratory
2331	A1043	University of North Carolina, Department of Physics and Astronomy
	2332	North Carolina University System
2332	14616	University of North Carolina, Greensboro
2332	14621	University of North Carolina, Wilmington
2332	14727	University of North Carolina, Charlotte
2332	1801	Appalachian State University
2332	2331	University of North Carolina, Chapel Hill
2332	2739	Western Carolina University
2332	3189	Elizabeth City Carolina University
2332	3338	Fayetteville State University
2332	3627	Eastern Carolina University
2332	6798	North Carolina State University
2332	8620	University of North Carolina, Asheville
	2340	Citadel Military College of South Carolina
	2343	College of Charleston
	2344	Eastern Illinois University
	2348	Massachusetts General Hospital
	2358	University of Virginia
2358	A1050	University of Virginia, Department of Astronomy
2358	A1051	University of Virginia, Department of Physics
	2359	University of Prince Edward Island, Canada
	2369	Anglia Ruskin University, UK
